company_name,short_description,website
Subtrace,Chrome DevTools for your backend,https://subtrace.dev
Hyphen,Medical Data Annotation Software,https://www.hyphenlabs.tech
Ryvn,"Deploy, update, and monitor applications in customer clouds",https://ryvn.ai
Gander,"LLMs For Aviation, Starting with Customer Service",https://usegander.com
Innate,Teachable general-purpose robots,https://innate.bot
CollectWise,Automating consumer debt collection with AI,https://collectwise.com/
Consus,Your single source of truth for government documents,https://www.consusindustries.co/
Alex,The Cursor for Xcode,https://alexcodes.app
Origami Agents,Agents that find your perfect customers,https://www.origami-agents.com
Scrapybara,Virtual Desktops for AI Agents,https://scrapybara.com
PermitPortal,AI Operating System for Pre-construction,https://permitportalapp.com/
Recase,KYC/B orchestration that resolves complex cases with customers,https://recaseai.com
Gecko Security,The AI Security Engineer to Find and Fix Vulnerabilities ,https://gecko.security
Curo,Electric fleets park and charge anywhere with Curo,https://www.curocharging.com/
Abundant,On-demand human workforce for AI agents,https://www.abundant.ai/
Moonshine,APIs for video understanding,https://usemoonshine.com
AutoComputer,Desktop RPA with AI computer use,https://www.autocomputer.ai/
Dexter,AI workflow automation for field operations,https://www.getdexter.co/
Crustdata,Real-time B2B data via simple APIs,https://crustdata.com
Aditto,Let AI manage your marketing.,https://aditto.co
vly.ai,Helping companies build full-stack software without developers,https://vly.ai
Tiny,A new kind of ERP system for factories,https://andtiny.com
Cekura,"Keep support, marketing, and sales materials up-to-date",https://www.cekura.io
Chorrie,Eliminate medical claim denials & underbilling with AI,https://chorrie.com
Metreecs,AI-powered demand forecasting for retail,https://www.metreecs.com
Diffusion Studio,Next Generation Canva for AI Video Editing in the Browser,https://diffusion.studio/
Pearson Labs,AI agents to automate corporate transactions,http://www.pearsonlabs.ai
Bifrost Orbital,24/7 and real-time connectivity for satellites,https://bifrostorbital.com/
Asha Health,We help medical practices launch their own AI clinic,https://asha.health
Fabricate,Procurement for Hardware Teams,https://www.tryfabricate.com
Synth,We help AI agents learn from data.,https://www.usesynth.ai
Roundabout Technologies,Software for AI-powered traffic lights,https://roundabout.tech
Canvas,AI-Copilot for Customer Success Teams,https://www.canvas.inc/
Relvy AI,Efficient AI for monitoring production software,https://www.relvy.ai
Helpcare AI,"AI Workers for Healthcare Orgs to Find, Call & Schedule More Patients.",https://helpcare.ai
Friday,An assistant that understands your emails and handles them for you,https://www.fridaymail.ai
Ember Copilot,The only medical scribe that reduces claim denials by 55%,https://www.embercopilot.ai
Melder,AI Data Integration for Supply Chain,https://melder.io
SRE.ai,Automated DevOps for Low-Code Platforms,https://sre.ai
Fix AI,AI agents that navigate websites like real users to find bugs,https://tryfix.ai
Foundry,Retool for AI Agents,https://www.thefoundryai.com/
HumanLayer,Human-in-the-Loop for AI Agents,https://humanlayer.dev
Forerunner AI,"Copilot for aerospace engineers making rockets, munitions, satellites",https://tryforerunner.com
OpenClinic,"Digital healthcare clinics that are 99% AI, 1% doctor.",https://www.tryopenclinic.com
Bramble,The next generation Zillow.,https://usebramble.com
Surge,Stripe for telephony,https://surgemsg.com
Sunset,Find and move money after a death,https://www.sunsetapp.com/
ArchiLabs,AI Copilot for Architects,https://archilabs.ai
Revi,AI-enabled M&A deal origination,https://www.revi.ai/
BeerMe,"Fun, global Venmo built on USDC",https://beerme.world/
Fresco,AI copilot for construction superintendents,https://fresco-ai.com/
HYBRD,Strava for the modern athlete,https://www.hybrd.app/
Coblocks,Build data pipelines in minutes with AI,https://coblocks.ai
Rulebase,AI agents for fraud detection and investigations.,https://rulebase.co
OpenFunnel,Personalised Agents for AI-First GTM Teams,https://openfunnel.dev
HealthSpark,Launch and run an AI-native physical therapy practice,https://www.joinhealthspark.com
Getcho,Local delivery platform for high-value goods,https://getcho.app/
Afternoon.co,AI Bookkeeping and tax platform for ecommerce & startup founders,https://afternoon.co
Encore,Conversational search and discovery for secondhand products ,https://www.shopencore.ai/
Summed AI,The AI Copilot for Insurance Agents,https://summed.ai
Upshift,Turn your software product into a platform.,https://upshift.dev
Lightscreen AI,Voice + video AI interviewer,https://lightscreen.ai
Docflow,We build automated scheduling software for hospitals,https://www.mydocflow.com/
ShowAndTell,Agents for the dental operating model,https://www.tryshowandtell.com
Symphony,Voice AI sims for next-gen employee training,https://getsymphony.co
telli,outbound call automation for B2C companies,https://telli.com/en/
Galini,Compliance guardrails-as-a-service for AI applications,https://www.galini.ai/
Platus,"Instant Legal Infrastructure - Draft, Sign, Notarize & Process",https://www.platus.com
Riveter AI,The copilot for corporate strategy,https://www.riveterhq.com/
Andoria,AI customer agent that generates in-app walkthroughs on demand,https://andoria.ai/
fixa,sentry for AI voice agents,https://www.fixa.dev
Variant,Building the state-of-the-art model for software design,https://variant.ai
Gait,Building Dev Infra for AI Software Engineers,https://getgait.com
Raycaster,Private investigator for enterprise sales,https://raycaster.ai
PearAI,VSCode For The New Age of AI,https://trypear.ai
supercontrast,AI Co-Pilot for Design,https://supercontrast.com/
Vocera,Testing & Observability for AI voice agents,https://www.vocera.ai/
Replexica,Automated AI localization for dev teams,https://replexica.com/
Sphinx,AI Compliance Analysts for Banks & Fintechs,https://sphinxlabs.ai/
Luthor,"AI-powered content, expertly refined by humans who know your brand.",https://luthor.ai
Codebuff,The CLI tool that writes code for you,https://codebuff.com
Keye,The Smartest Private Equity Investor,https://www.keye.co
RiskCube,Digital insurance brokerage for property & casualty risks. ,https://riskcube.com
CTGT,Entirely New AI Stack: Efficient and Safe Alternative to LLM Ecosystem,https://www.ctgt.ai/
StudyDojo,AI tutors for students.,https://studydojo.com
ISSEN,AI realtime voice companion for language learning,https://issen.com
Karmen,AI Assistant for Construction Project Managers,https://www.karmenai.com
Reticular,Interpretable AI for drug discovery,https://reticular.ai
Protegee,Payments API for AI Voice Agents,http://protegee.ai
Sandra AI,"Building AI employees for car dealers, starting with AI receptionists",https://www.sandra-ai.com
Regatta Storage,"Transform S3 in an unlimited, local file system",https://regattastorage.com
Praxis AI,Manufacturing reasoning agents to predict and prevent machine failures,https://praxis-tech.ai
Revyl,Proactive observability,https://www.revyl.ai
Astrix Health,Astrix builds AI purchasing agents for healthcare providers.,https://www.astrix.health
Lune AI,Better GPT and Claude for coding,https://www.lune.dev/
Circlemind,Circlemind is an open-source RAG using knowledge graphs and PageRank.,https://circlemind.co
Vespper,"AI agent that troubleshoots production alerts for software engineers,…",https://vespper.com
Clara,"Helping families discover, hire, and manage in-home caregivers",https://www.clarahomecare.com/
Stack Auth,The open-source Auth0 alternative,https://stack-auth.com
Wordware,"IDE to develop, iterate and deploy AI Agents",https://wordware.ai/
VideoGen,AI that can create and edit professional videos,https://videogen.io
Sorcerer,We build weather balloons that collect 1000x more data,https://sorcerer.earth
Corgi,Corgi is building an AI insurance company,https://secret.corgi.insure
Maitai,"Reliable, self-improving enterprise AI",https://trymaitai.ai
Random Labs,Random labs is building fully open source software agents,https://
Tabular,AI Copilot for accounting firms in Europe,https://www.gotabular.de/en/
Flyflow,The easiest way to find high-quality sales leads,https://flyflow.ai
Callback,AI-native business process outsourcing,https://getcallback.ai
Codes Health,Perfect medical histories prior to care,https://www.getcodeshealth.com/
DigitalCarbon,Transform Images And Videos Into Immersive 3D With AI,https://www.digitalcarbon.ai
Decisional AI,AI Agent for private markets that accelerates deep financial work,https://www.getdecisional.ai/
Entangl,Automating hardware design end-to-end without errors,https://www.entangl.ai/
Unsloth AI,Open Source Fine-tuning & Training of LLMs,https://unsloth.ai/
Phonely,AI call centers ,https://phonely.ai
Azalea Robotics Corporation,Automating airport baggage handling with robots.,https://azalearobotics.com/
Rewbi,Rewbi uses AI to increase grid-connected battery storage revenue 2x,https://www.rewbi.com/
Moonglow,No-code platform for building browser agents,https://moonglow.ai
ClaimSorted,Making it easy for insurance companies to process claims,https://claimsorted.com
Storia AI,Open source AI copilot that knows your company's code and its context,https://storia.ai
"DeepSim, Inc.",An AI physics simulator for AI chip design,https://www.deepsim.io
Lucible,Combined checking and investment account,https://luciblefi.com
Dodo,AI Employees for Specialty Clinics,https://www.dodo.health/
Offstream,Vanta for carbon compliance,https://www.useoffstream.com/
reworks,Turn external software into APIs that don’t break,https://www.reworks.ai
Zuni,Smarter email for founders,https://zuni.app
Aviary,Video Intelligence,https://aviary.video
Proxis,The developer platform for LLM distillation and serving.,https://www.proxis.ai/
Willow,AI-powered Revenue Cycle Management for Long-term Care,https://seewillow.com/
NetworkOcean,We build and operate underwater data centers.,https://networkocean.io/
Silurian,"Foundation models to simulate Earth, starting with weather.",https://silurian.ai/
Unbound Security,Allow employees to use AI tools without fear of data loss,https://www.unboundsecurity.ai/
Kura,The AI DevOps Copilot for Software Teams,https://www.usekura.com
RetroFix AI,Turbo Tax for Building Rebates,https://www.retrofix.ai/
ideate.xyz,Automate marketing graphics design at scale,https://ideate.xyz
FirstWork,Rippling for seasonal workers,https://firstwork.com
Hamming AI,Automated AI voice agent testing,https://hamming.ai/
Kairo Health,The AI healthcare workforce,https://trykairo.com/
Genie,Conversational AI Sidekick for Kids.,http://www.genie.gg
Evolvere BioSciences,Making Next-Generation Antibiotics that Outpace Bacterial Evolution,https://www.evolverebiosciences.com/
Spur,Spur is your AI QA Engineer. Test your websites with natural language.,https://www.spurtest.com/
ACX,Therapeutics inspired by bacteria's natural killing abilities,https://www.acxtherapeutics.com/
Ultra,Robots to package billions of e-commerce orders in warehouses,https://ultra.tech
Fuse,Boosting contracted revenue for US healthcare providers,http://www.fuseinsight.com
Cracked,AI Motion Graphics Copilot,https://www.cracked.so/
Ångström AI,Gen AI molecular simulations that reproduce wetlab results,https://www.angstrom-ai.com
Coval,Simulation & Evaluation for AI Agents,https://coval.dev
Ligo Biosciences,AI designed enzymes for the chemical industry.,https://www.ligo.bio
Poka Labs,The modern operating system for chemical manufacturing.,https://www.pokalabs.com/
Central,"Eliminating business bullshit: payroll, benefits, compliance, etc",https://centralhq.com
Invaria,The next generation logging and observability platform,https://invaria.com
Elevate,Financial infrastructure for AI agents,https://www.useelevate.dev/
Pumpkin,Your artificially intelligent web browser,https://www.browsewithpumpkin.com/
Panora,AI Copilot for Warehouse Coordinators,https://panora.dev
Aviary,AI Video Intelligence,https://aviary.video
Simplex,Synthetic datasets for vision models,https://simplex.sh
Abel Police,Automating police paperwork,http://abelpolice.com
CardLift,We help card issuers maximize their share of wallet.,https://withcardlift.com
Miru,Deployment infrastructure for robotics and IoT,https://www.miruml.com
Educato AI,AI-Powered Worldwide exam-prep platform,https://www.educato.ai/
ProhostAI,AI Property Manager for Airbnb & Short-Term Rental Hosts,https://www.prohost.ai/
Comfy Deploy,Vercel for Gen AI applications,https://comfydeploy.com
Synnax,Unified Hardware Control and Data Processing Software,https://www.synnaxlabs.com/
Theseus,GPS Denied Navigation for Drones,https://theseus.us
Spaceium Inc,In-Space Refueling,https://spaceium.com
Saphira AI,Vanta for Hardware,https://saphira.ai
Glasskube,Open Source Package Manager for Kubernetes,https://glasskube.dev/
Cheers,The super-app for in-person businesses,https://www.cheers.tech
Mem0,The Memory layer for your AI apps,https://mem0.ai
Undermind,An AI agent for complex search,https://www.undermind.ai
Ceejay,Intelligent assistant for knowledge workers,https://tryceejay.com
Domu Technology Inc.,Automating debt collection calls for banks.,https://www.domu.ai/
Apten,Customizable AI SMS agents for businesses,https://www.apten.ai/
Spherecast,AI Supply Chain Manager for Ecommerce,https://www.spherecast.ai/
Ply Health,Faster way to get providers in-network with payers.,https://plyhealth.com
Superunit,AI powered ERP for companies manufacturing or selling physical goods,http://superunit.ai
mdhub,AI assistants for mental health clinics to efficiently run their ops,https://www.mdhub.ai/
CodeViz,AI agent that builds codebase maps for developers,https://www.codeviz.ai/
Bayesline,Highly customizable and blazingly fast analytics for asset managers.,https://bayesline.com
Parahelp,The AI support agent used by Perplexity and Captions.ai,https://parahelp.com/
Vendra,AI copilot for hardware teams working with vendors,https://vendra.io/
Argil,The video generation engine for the creator economy ,https://www.argil.ai/
Propaya,AI-powered software to automate property management.,https://www.propaya.com
Kontigo,USDC-Smart Neobank for Latinos. ,https://kontigo.lat/
autarc,autarc is the OS for Europe's One-Stop Energy Installers,https://www.autarc.energy/en
omnidock,OS for global e-commerce expansion of brands & manufacturers,https://www.omnidock.com
Remo,AI for compliance teams at banks,http://getremo.ai
Sepal AI,Building LLMs for Large Enterprises.,https://www.sepalai.com
Actionbase,Automate popular websites in a few lines of code,https://actionbase.co
Assembly HOA,AI-enabled HOA Management Company,https://assemblyhoa.com
Simplifine,AI-Powered Workspace for Research,https://www.simplifine.com
Weavel,"Automate prompt & LLM engineering, 50x times faster than a human",https://weavel.ai
Ares Industries,Building low-cost cruise missiles ,https://aresindustries.com
Voker,No-Code AI Builder,https://voker.ai
Rastro,AI personal shopper for home goods,https://rastro.sh
Quetzal,"Simple, LLM-first translation and internationalization for software",https://getquetzal.com/
Moreta,Payments made easy for international travelers.,https://moretapay.com
TradeFlow,AI-powered settlement for financial securities,https://www.tradeflowai.com/
Polymet,AI Product Designer,https://polymet.ai
Mindely,The first GenAI interviewer for skills assessment interviews,http://www.mindely.ai
ZeroPath,Automatically find and fix your software vulnerabilities,https://zeropath.com
Lumen Orbit,Data centers in space,https://www.lumenorbit.com/
Lilac Labs,We automate the person taking orders at drive-thrus with a voice AI,https://www.drive-thru.ai/
Palmier,AI Native Github Alternative,https://www.palmier.io
Blast,Helping enterprises build safe and compliant LLM apps/agents,https://withblast.com
Paasa,Simplifying global investing for HNIs in emerging markets,https://paasa.com
Odo,Help companies find and win government contracts with AI,https://www.odo.do/
Cartage,Autonomous freight coordination,https://cartage.ai
Winford AI,Automating Financial Workflows,https://winford.ai/
RiskAngle,Medical record summary in minutes,https://www.riskangle.com/
Dataleap,Perplexity for Consultants,https://dataleap.ai/
Baseline AI,AI document creation and data management for clinical trials,https://www.baselinetrials.com/
Finosu,Workflow automation for the credit industry,https://www.finosu.com
&AI,Accelerate patent due diligence with AI,https://www.tryandai.com/
Helium,Self Improving Software,https://tryhelium.com
Ionworks,Simulation software used by leading battery and automotive companies,https://ionworks.com/
Thyme,The OS for financial advisors,https://www.meetthyme.com/
Frontio - by NextUI,Frontio simplifies frontend creation by automating design systems and…,https://frontio.ai
Rescript,AI Regulatory Analyst for Enterprises,https://rescript.ai/
Zimi,"Platform for international brands to sell, ship, and get paid globally",https://www.withzimi.com
Haystack Software,Visualize and edit your codebase on an infinite canvas,https://haystackeditor.com/
pap!,"Agents that earn consumers dollars when they shop, travel, and live.",https://joinpap.com/
Blaze,Global Venmo for cross border payments,https://blaze.money
Bucket Robotics,Defect detection for manufacturing built from CAD and synthetic data.,https://bucket.bot
Kart AI,The AI shopping assistant for all e-commerce brands,https://kart.ai
Village Labs,Helping America's businesses become employee owned,https://villagelabs.app/
Overlap,Overlap is Perplexity for video & audio content,https://www.joinoverlap.com/
Formula Insight,"Help Institutional Investors manage, track & query their Excel models",https://www.formulainsight.io/
Midship,"Extract, search and analyze data in your documents",https://midship.ai/
OrgOrg,Organizational productivity suite for companies,https://orgorg.us
Affil.ai,AI Affiliate Network For Financial Companies,https://affil.ai/
Freestyle,Build exceptional infrastructure with just JavaScript.,https://www.freestyle.sh
Void,The open source Cursor alternative,https://voideditor.com
Merlin AI,AI powered ERP for Construction,https://www.merlinai.co
Patched,Open-source workflow automation for dev teams,https://patched.codes
Arva AI,AI enabled business verification for banks and fintechs,https://www.arva.io
Syntra,AI OS for Private Practice Doctors,https://www.syntra.com
Outerport,VMware for GPUs,https://outerport.com
DreamRP,Bring your characters to life,https://www.dreamrp.com/
PathPilot,The AI Customer Experience Agent ,https://www.getpathpilot.com/
Standard Data,Augmented Reality Training and Copilot for Manufacturing,https://www.standarddata.com/
Melty,Melty is the first chat-based code editor,https://melty.sh
Soma Lab,Conversations with AI patients to scale healthcare training.,https://somalab.ai
Anglera,AI-native operating system for e-commerce,https://www.anglera.com/
Capitol AI,Capitol is a custom perplexity for every website in the world.,https://www.capitol.ai/
Mica AI,AI Agents that Automate B2B Sales,https://usemica.com/
Elayne,AI family estate planning & settlements after death,https://www.elayne.com/
Oway,Ridesharing freight with ML to cut pallet shipping costs by 50%,https://www.shipoway.com
Saldor,AI Software Engineers,https://saldor.com/
AI Sell,AI Sales Associate for Ecommerce,https://www.aisell.com
Usul,Win Defense Contracts with AI.,https://www.usul.com
SureBright,Apple Care-like warranty program for every retailer ,https://surebright.com/
et al.,Feed of insights extracted from your go-to sources using LLMs.,https://www.et-al.io
"Diode Computers, Inc.",Automate circuit board design using AI,https://diode.computer
Terra,Terra is like Faire for custom goods,https://useterra.com/
Keet,Authentication for AI Agents,https://trykeet.com
Pharos,Automate hospital reporting and prevent patient harm with AI,https://pharos.health/
Hey Revia,Voice AI to automate complex phone calls for healthcare providers,https://heyrevia.ai
Vera Health,AI-powered clinical decision support for healthcare providers,https://www.vera-health.ai
RowBoat Labs,LLM agents for customer support in fintech,https://www.rowboatlabs.com
XTraffic,Technology for cities to automate and manage their traffic lights.,https://XTraffic.com/
Pipeshift,"Platform for Fine-tuning, Distilling and Inferencing Open-source LLMs.",https://pipeshift.com
Ficra,"Real time, source of truth for every product screen and user flow",https://ficra.ai/
Henry,Automating Deal Decks for Commercial Real Estate Brokers,http://www.henry.ai
Felafax,Building AI Infra for non-NVIDIA GPUs ,https://felafax.ai
Laminar,Open-source all-in-one platform for engineering AI products,https://www.lmnr.ai/
Guardian RF,Drone detection and signal intelligence for US defense. ,https://guardianrf.com/
Focus Buddy,AI Productivity Coach you speak with while working to stay focused…,https://www.focusbuddy.ai/?ref=yc
The Forecasting Company,Foundation models for time series,https://www.theforecastingcompany.com
Zenbase AI,Continuous prompt optimization for LLMs from DSPy core contributors,https://zenbase.ai
Substrate,Artificial Intelligence for your medical billing team,https://www.substrate.cc/
TaxGPT,AI Co-Pilot for Accountants,https://www.taxgpt.com
Benchify,Bug-free code without writing tests,https://www.benchify.com
Kopra Bio,Genetically engineered viruses that teach your immune system to kill…,https://kopra.bio
Fazeshift,AI agent for Accounts Receivable,https://www.fazeshift.com/
Anthrogen,We make molecules like fuels and plastics from the air.,https://anthrogen.com
Manaflow,Build internal tools for AI using natural language,https://manaflow.com
Taxo,Automated medical billing and coding,https://taxo.ai
Kastle,AI voice agents for mortgage servicing,https://kastle.ai/
Parity,The World's First AI SRE,https://tryparity.com
expand.ai,Turn any website into an API.,https://expand.ai/
Panora,Data Connectors for LLMs,https://panora.dev
Clearly AI,Automate security and privacy reviews,https://clearly-ai.com
Ontra Mobility,Platform for cities to optimize transit ,https://www.ontramobility.com
Promi,"Optimizing ecommerce pricing with dynamic, personalized discounts",https://www.usepromi.com/
Overstand Labs,The cross-selling engine for enterprise software companies,https://overstandlabs.com
Fortress,Globally replicated and sharded Postgres,https://fortress.build
Conveo,Qualitative Research Conducted and Analyzed by AI,https://conveo.ai/
Olive Legal,AI medical summaries for injury lawyers,https://olive.legal
Lighthouz AI,AI procurement specialists for manufacturers,https://lighthouz.ai/
Mito Health,AI Preventive Health Provider,https://mitohealth.com/
Neuralize,The On-Device AI Deployment Platform ,https://runlocal.ai
Snowpilot,The connected spreadsheet that destroys data silos,https://www.snowpilot.com
MinusX,AI Data Scientist for Jupyter and Metabase,https://minusx.ai
Passage,"Clear goods through customs, with AI",https://www.trypassage.com/
Tivara,Using LLMs to automate insurance approval for healthcare clinics,https://tivara.com
camfer,Building the world’s first AI mechanical engineer.,https://www.camfer.dev/
Sensei,Robotic Training Data at Scale,https://senseirobotics.com
Merse,"Visual stories like comics, but with immersive audio effects.",https://merse.co
Modus,Unlock revenue per employee with AI-powered headcount management,https://himodus.com
AnswerGrid,AI research agents for Strategy Consultants and Investment Analysts,https://answergrid.ai/
AminoAnalytica,AI for improved protein production and performance,https://www.aminoanalytica.com
Weave Robotics,Personal robots for the home--that ship in 2025,https://www.weaverobots.com
AutoPallet Robotics,We make robots that move boxes in warehouses,https://autopallet.bot
stormy.ai,Influencer marketing on autopilot,https://stormy.ai
Pulse AI,Production-Grade Unstructured Document Extraction,https://www.trypulse.ai
LedgerUp,Your first and only finance hire,https://ledgerup.ai/
Plume,Home energy renovation copilot,http://www.plumefinder.com
dmodel,Look inside the model,https://www.dmodel.ai
Gauge,Solving the monolith/microservices dilemma.,https://gauge.sh
Saturn,Compliance and back office workflows for Wealth Managers.,https://www.SaturnOS.com
Tandem,Marketplace to help companies lease and share office space,https://tandem.space/
1849 bio,Engineering microbes for miners to unlock billions in trapped metal,https://www.1849.bio
Remade,Using AI to hyper-personalize videos for marketplaces,https://www.remade.ai/
BeeBettor,Robinhood for sports betting,https://beebettor.com
David AI,Data for audio AI,https://www.withdavid.ai/
Modern Realty,AI Tools for Transactional Support,https://raymondxproperties.com
Kura AI,New State of the Art for Browser Agents,https://trykura.com
Distro,The AI co-pilot for sales reps at industrial wholesale distributors.,https://distro.app
Thunder Compute,Virtualization software to make GPUs 5x cheaper,https://thundercompute.com
Ember Robotics,Datadog for robots,https://www.emberrobotics.com
Mineflow,Mineflow predicts the shape and location of mineral deposits,http://mineflow.ai/
Brighterway,Streamlining the record review process for physicians in medlegal…,https://www.brighterway.ai/
Cerulion,Open source operating system for robots,https://www.cerulion.com
Pinnacle,API & SDK for RCS (the next-generation of texting),https://trypinnacle.app/
Intryc,Intryc uses AI to automate quality assurance for customer support,https://intryc.com
Parley,"Automating flat-fee legal work, starting with work visas + green cards",https://parley.so
Soff,Supply Chain OS for manufacturing companies.,https://soff.ai
SchemeFlow,Automating Government Approvals for Construction Projects,https://www.schemeflow.com
Exa Laboratories,Energy efficient chips for AI,https://exalaboratories.com
