company_name,short_description,website
Stacker,Turns spreadsheets into internal apps and customer portals,https://stackerhq.com
Formal,Take control of your data in real-time.,https://joinformal.com
Tappity,World's largest library of interactive lessons for kids,https://www.tappityapp.com
inFeedo AI,"AI to engage employees, predict attrition and automate HR/IT support",https://infeedo.ai
Roboflow,🖼️ Give your software the sense of sight.,https://roboflow.com
Lightdash,The open source Looker alternative ,http://lightdash.com/
Jeeves,International banking infrastructure for global startups.,http://www.tryjeeves.com
SuperTokens,Open source alternative to Auth0 / AWS Cognito / Firebase Auth,https://supertokens.com
Blue Onion Labs,Single source of truth for a company's financial data,https://www.blueonionlabs.com
Datafold,Deal with analytical data quality in the pull request,https://datafold.com
Depict,Merchandising for fashion e-commerce,https://depict.ai/
"Zitara Technologies, Inc.",Predictive battery management software for electrified fleets,https://zitara.com
Momence,Scheduling and payments for experiences,https://momence.com
Dripos,The only piece of software a coffee shop needs to operate.,https://dripos.com
AtoB,Rebuilding global transportation payments.,https://atob.com/
Conta Simples,All-in-one financial platform for latam Startups and SMBs.,https://contasimples.com/
Shuttle,Build Backends. Fast.,https://www.shuttle.rs
QuestDB,The fastest open source time series database,https://questdb.io/
Command AI,AI-powered user assistance platform,https://command.ai
Zip,The future of B2B spend,https://ziphq.com/
Increase,Enterprise-grade banking APIs,https://increase.com/
Ukama,Empowering anyone to build  cellular network,http://www.ukama.com
Reflect,No-code test automation for web apps,https://reflect.run
Hellosaurus,Interactive video platform for kids,https://hellosaur.us/join
Unfaze AI,Create stunning product images and short-form promotional videos 10x…,https://unfaze.ai/
Nestybox,Enables Linux containers to act as super fast & efficient VMs,https://www.nestybox.com
Brevy,Empower your customer service team through AI & automation.,https://brevy.com/
Porter,Easiest way to deploy on AWS/GCP/Azure,https://porter.run
Nextera Robotics,AI-native Robotics,https://nexterarobotics.com
Seam,API for IoT Devices,https://seam.co
Response,Control indirect spend from end-to-end.,https://www.tryresponse.com/
twoplus fertility,An effective home-use fertility treatment for natural conception,http://twoplusfertility.com
Photoroom,Power commerce photography with generative AI,https://photoroom.com/
adyn,The first test designed to prevent birth control side effects,https://www.adynhealth.com
Thndr,Investment platform for MENA individuals,http://www.thndr.app
Altro,Build Credit With Your Subscriptions,https://altro.io
Luminai,Luminai helps automate repetitive manual work away from your mission…,https://www.luminai.com
Jitsu,Capture Event Data into Your Stack,https://jitsu.com
Salesform,"Qualify, route, and convert more inbound leads",https://salesform.com
Safepay,Digital payments for businesses in Pakistan,https://getsafepay.pk/
Basedash,The admin panel you don't have to build.,https://www.basedash.com
Queue,All-in-one platform for agencies to launch and grow,https://usequeue.com
doola,Business-in-a-Box™ for LLCs,https://www.doola.com/
Arist,Deliver effective learning at scale ,https://www.arist.co
Justo,Helps restaurants take online orders directly from customers,https://www.getjusto.com
webapp.io,Build webapps faster with 10x better CI/CD + preview envs,https://webapp.io
Cradle,B2B payments network in India,https://www.cradlefinance.com
Seal,All-in-one workspace for companies making regulated products,https://seal.run
Nabla Bio,We use AI to design antibodies for intractable diseases,https://www.nabla.bio
Blissway,The tolling industry’s prime tech infrastructure,https://www.blissway.com/
Bits,Bits is a credit card designed to help people build credit,https://www.getbits.app
MarketForce,The SuperApp for neighbourhood merchants in Africa. ,https://marketforce.io
Daybreak Health,The first digital mental health system for youth,https://www.daybreakhealth.com/
Osmind,Platform for breakthrough mental health research and treatment,https://osmind.org/
Yotta,Save money and win prizes up to $10m through weekly number draws.,https://www.withyotta.com
Mesh,Performance management platform that fits the way you work,https://mesh.ai/
Hellometer,Making fast food faster,https://hellometer.io/
VenoStent,Absorbable wrap for blood vessels,https://www.venostent.com
Atomic,API that lets companies embed investment accounts into their services,https://www.atomicvest.com/
TANGObuilder,TANGObuilder automates structural engineers jobs. ,https://www.tangobuilder.com
Biocogniv,,http://biocogniv.com
Farmako Healthcare,India's fastest medicine delivery in just 30 minutes,https://farmako.in/delivery
CoreCare,Making it easy for healthcare providers to collect payments ,https://corecare.io/
Explorex,Ecosystem Platform for Restaurants in India,https://explorex.co
Volopay,Brex for South East Asia - Corporate cards & automated payments.,https://www.volopay.co/
Novel,Novel is your international business bank account,https://www.trynovel.com/
Duckly,Video chat with real-time collaboration.,https://duckly.com
Dialect,A protocol & developer stack for delivering your product experiences.…,https://dialect.to
Hypotenuse AI,Create unique copywriting and visual content in seconds using AI,https://hypotenuse.ai/
Synapticure,We deliver personalized medicine for neurodegenerative  patients,http://www.synapticure.com
PowerUs,LinkedIn for skilled blue-collar workers ,https://www.powerus.de
Swif.ai,Compliance-First Device Security,https://www.swif.ai
Kernal Biologics,Kernal is creating mRNA 2.0 therapies that work in specific cells,https://www.kernalbio.com/
BukuWarung,"Accounting, Payments & Credit app for 60M micro-businesses in…",http://bukuwarung.com/app
Clover,"The all-in-one notebook for creatives to brainstorm, write, and plan…",https://cloverapp.co
Speedscale,Accelerate development by simulating production conditions with real…,https://speedscale.com
Pave,"Plan, communicate, and benchmark your compensation in real-time.",https://pave.com
Humanloop,Humanloop is the LLM evals platform for enterprises. ,https://humanloop.com
FitnessAI,App offering AI powered workout plans with anytime access to coaches,https://fitnessai.com
Viya,Mobile first apartment rentals for LatAm,http://www.viyaliving.com
Synapsica Healthcare,AI-enabled automation of diagnostic radiology workflow and reporting.,https://synapsica.com/
Syncro,Zapier for scaling high-touch talent management,https://runsyncro.com/
Valienta,Helping Dropshippers in Colombia run the business and increase sales,https://valienta.com
Zumo Labs,We generate synthetic data for computer vision models.,https://zumolabs.ai/
LabGrid,Collaborative software for high-throughput biotech,https://www.labgrid.com
Apartio,Apartio offers Short Term Rentals for Business Travelers in Brazil,http://www.apartio.com.br
Thunderpod,Community Engagement Platform,https://www.thunderpod.com/
SprintAI,AI-led platform for inventory and fulfillment optimization,https://www.getsprint.ai/
Snapboard,,https://snapboard.io
onetool,"App-Store for SaaS: one invoice, one user management, one login.",https://onetool.co/
Orchata,Groceries delivered in 20 min in Latinamerica,http://www.orchata.com/
Volumetric,Volumetric builds living multicellular tissues with a focus on the…,https://volumetricbio.com/
Savvy,Flexible stipends for employee health insurance,https://www.gosavvy.com
Zaraz,"A third-party manager, built for speed. ",https://zaraz.com/
Okay,Dashboards and actionable insights for high-performing engineering…,https://www.okayhq.com
Hoss,The developer experience platform,https://hoss.com
Phonic,The best way to collect and analyze voice and video feedback,https://phonic.ai
yearend,Optimize your equity and taxes in real-time.,https://yearend.com
Flowdash,Quickly build internal tools for your ops team's manual workflows,https://flowdash.com
Weav,Weav is the universal API for commerce platforms,https://weav.co
Glimpse,A social video chat.,https://www.joinglimpse.com
Eternal,Own the best moments in streaming,https://eternal.gg/
Terusama,We help warehouses schedule trucks,https://velostics.com
Dropprint Genomics,The better way to run single cell genomics,http://dropprintgen.com/
Simple Strips,Low-cost blood glucose test strips scanned with a smartphone camera…,https://simplestrips.com
Talyn Air,"Long range, battery electric vertical take-off and landing aircraft.",http://www.talyn.com
CARUPI,CARUPI is the world's 1st managed P2P marketplace for used cars,https://www.carupi.com/
Multiverse,Multiverse is a web-based game creation system inspired by Dungeons &…,http://www.playmultiverse.com
Pantheon,A competitive community of the brightest students in the world,https://www.joinpantheon.io/
Pashi,Pashi builds software to operate and optimize production lines.,https://pashi.com
Typedream,Build & launch your website in minutes with AI,https://typedream.com/
Hideout,A portfolio of delivery-only restaurant brands,http://findhideout.com
Nugget,,https://
Datree,Datree prevents Kubernetes misconfigurations from reaching production,https://datree.io
Paneau,Tablets inside Uber/Lyfts to advertise directly to riders,https://paneau.io
Laguna,,https://withlaguna.com
RoboTire,Robotire is automating vehicle maintenance for today and future…,http://www.robotire.com
Lilia,Modern egg freezing for half the cost in half the time with top docs,https://www.hellolilia.com/
Carbon-12 Labs,A Global Payouts API for Startups,https://www.carbon.money
Orbiter,ML models automatically monitor business performance,http://www.getorbiter.com
Ardis AI,Transform your text data into a searchable knowledge graph,http://www.ardis.ai
Quickcard,Dynamic sales materials that shape-shift based on the customers needs,https://quickcard.com
Jamiphy,TikTok for Musicians,https://jamiphy.com
Glisten AI,Glisten AI automatically categorizes and tags e-commerce product data.,http://glisten.ai
Cadence,Delightful team-building events for remote companies,https://www.cadencework.com
Edlyft,Helps enterprises train college CS students on essential job skills,http://edlyft.com
"Exosonic, Inc.",Developing supersonic UAVs as a pathway to quiet supersonic flight,https://exosonic.com/
The Mercer Club,The Mercer Club is a subscription service that allows men to rent…,https://www.themercerclubnyc.com
Protobase,"Protobase is a 10x, next-generation spreadsheet.",https://www.protobase.io
Clayboard,"Create active, collaborative learning experiences ",http://clayboard.com
Duffl,10-minute delivery service for college students.,https://www.duffl.com
Homestead,Homestead is a real estate development platform for homeowners,https://www.myhomestead.com/
Visual One,AI for security cameras,https://www.visualone.tech
Felix Biotechnology,We’re creating programmable therapies,https://www.felixbt.com/
Blok,A platform for fitness instructors to build their business and…,https://blok.fit
Riya Collective,Riya Collective is building the first community-driven global…,http://riyacollective.com
Zaam,Zaam is an end-to-end SaaS solution for business onboarding.,http://zaam.io
Global Belly,Marketplace enabling social commerce for brands and content creators. ,https://globalbelly.com/
Scout,Dead simple CI/CD for ML teams,https://www.scout.ml/
goDutch,Group payments product which lets people pay together at any offline…,https://godutchpay.in
Able,India's Largest Placement Platform for Early Professionals,https://ablejobs.co/
Checkars,E-commerce site where you can buy certified used-cars in Latin America,https://www.checkars.com
yBANQ,yBANQ is building a Bill.com for India to simplify collections and…,https://ybanq.com
Hiration,We help job seekers quickly create resumes that get 2X more interviews,https://www.hiration.com/
Pahamify,College entrance test preparation App for students in Indonesia,https://pahamify.com/
Bikry,Bikry: Helping SMB's in India go online ,https://bikry.com/
HireSweet,A talent acquisition software built for data-driven recruiting teams.,http://www.hiresweet.com
Easyplan,An AI-driven investment app for beginner investors in India,https://easyplan.in/
Raycast,Speed up non-coding tasks for engineering teams,https://raycast.com
Breathe Well-being,A digital well-being program to help people prevent or manage chronic…,http://www.breathewellbeing.in
Spenny,Acorns for India. Every time you swipe you make a digital…,http://spennyapp.com
Oda,AI Agent for Home Design,https://www.odastudio.ai/?ref=yc
OpenBiome,A nonprofit stool bank enabling access to fecal transplants.,http://openbiome.org
Nexu,Financing platform for LatAm car dealerships.,https://www.nexu.mx/
Isabl,Cancer tests based on whole genome and transcriptome data.,http://isabl.io
Avion,Avion builds and operates autonomous eVTOL drones that deliver vital…,http://www.avion.health
Daedalus,AWS for precision manufacturing,https://daedalus.de
SOMATIC,Bathroom cleaning robots for office buildings. ,http://getsomatic.com
Moons,Moons provides high quality orthodontics in LATAM at accessible prices,https://mymoons.mx
Angle Health,Health Insurance for Startups,https://www.anglehealth.com
EduRev,Learning App for 400M Indian Students like a Netflix for Education,http://edurev.in
Zeo Route Planner,Route Optimisation platform for SMB in delivery & home services.,https://zeorouteplanner.com
Morphle Labs,Robotic Automation for cancer diagnostics - Robotic Microscopes &…,https://morphlelabs.com
Fella Health,The telehealth clinic for men with obesity,https://www.fellahealth.com/
Riot,Cybersecurity awareness for fast growing companies,https://tryriot.com/
PostHog,Open source product operating system,https://www.posthog.com
Jitter,Fast and simple animation tool on the web 💫,https://jitter.video
PostEra,Medicinal Chemistry powered by Machine Learning,https://postera.ai/
Vital,API for at-home health data,https://tryvital.io
Skypher,Cybersecurity compliance cockpit,https://skypher.co
Laserfocus,Implement streamlined Salesforce processes for agile GTM teams,https://www.laserfocus.io/
Upflow,Modern cash collection for B2B businesses.,https://upflow.io/en/
DeepSource,The Code Health Platform,https://deepsource.com/
Kosh,Creating Microfinance 2.0.,https://getkosh.com
UrbanKisaan,Reimagining Food through Farming,https://www.urbankisaan.com
Flasho,An AI that conducts user interviews for you regularly,https://flasho.ai/
farmtheory,India's first vegetable delivery service to restaurants with a hack,http://farmtheory.in/
Pay Swifter,Stripe for Cannabis,https://payswifter.com
StayQrious,"StayQrious helps kids in India learn through online group classes,…",https://StayQrious.com
PillarPlus,Software to automatically create construction blueprints,https://pillarplus.com
Bamboo,Bamboo ― the first online brokerage service for Africans and their…,http://investbamboo.com
Tajir,The one-stop shop for mom-and-pop stores in Pakistan to buy inventory.,https://tajir.app
Fondeadora,We are connecting every single Mexican to the financial system.,https://fondeadora.com/
Swipe Technologies,"Building modern payments, accounting and cashflow management tools…",https://getswipe.com
Airbyte,Open Data Movement Platform,https://airbyte.com/
PowerX,"AI powered sensors that save energy, water and emissions",http://www.powerx.co
Workpay,"Payroll, Benefits and HR solutions for local and remote teams.",https://myworkpay.com
Humanly,"We empower the world’s hiring teams to grow engaged, high-performing…",https://humanly.io
Prelay,Team Selling Platform,https://prelay.com
Tasker ai,Building AI agent automation layer of the internet,http://www.tasker.ai
Gas Pos,Modern Point of Sale for Gas Stations and Truck Stops,https://gaspos.co
Equator Therapeutics,We are developing a drug to burn calories and increase metabolism…,https://equatortherapeutics.com/
Legionfarm,We connect gamers with training and assistance from Pro players,https://legionfarm.com/
Belvo,Open Finance API platform for Latam.,https://belvo.com
Menten AI,Menten AI designs peptide and protein therapeutics using quantum…,http://menten.ai
Yassir,Yassir is the leading Super App for French Speaking Africa,https://yassir.com
Jenfi,Jenfi provides revenue-based financing for digital businesses in Asia ,http://jenfi.com/
Whatnot,Whatnot is the largest livestream shopping platform in the U.S.,https://www.whatnot.com
Ansa Biotechnologies,Next-generation DNA synthesis using enzymes,http://ansabio.com
Ochre Bio,RNA medicines for liver diseases,https://www.ochre-bio.com/
Jet Admin,No-code business app builder,https://jetadmin.io
Tambua Health,The T-Scope is an app-based handheld ultrasound system that brings…,https://www.tambuahealth.com
Modernbanc,The best way to manage your business finances.,https://modernbanc.com
SEND,Flexport for Africa - Digital Freight forwarder and Customs Broker.,https://www.send.ng
99minutos,The fastest shipping for online shopping ,https://99minutos.com
Linkana,The leading SRM platform for LatAm,https://www.linkana.com
ElectroNeek,Robotic Process Automation and Document Processing Platform,https://electroneek.com
BeGo,BeGo Connects cargo shippers with truck suppliers in Mexico and US,http://www.bego.ai
Termii,Termii is helps businesses communicate with customers globally.,https://termii.com
STARK BANK,Challenger bank for enterprises,https://starkbank.com
GuruHotel,The Shopify for the hotel industry.,https://guruhotel.com
Zynq,Office management platform that optimizes your hybrid workplace,https://zynq.io
Nomic Bio,Nomic is doing for proteins what Illumina has done for DNA,http://www.nomic.bio
Handl,"Handl converts documents (invoices, income stabs, custom forms, etc.)…",https://handl.ai/
Ramani,We're building financial infrastructure for Africa's supply chains,http://www.ramani.io
Recall.ai,"The universal API for meeting video, audio and metadata",https://www.recall.ai
Stable,A virtual address + mailbox for business,https://useStable.com
GiveAway,Community driven marketplace for used things ,http://giveaway.mobi
borong,borong is a SaaS-enabled marketplace that connects brands like…,https://www.borong.com/
Healthlane,Africa's Preventative Health System,http://healthlane.co
Sakneen,Shopify for Real Estate Developers,http://www.sakneen.com/
Atmo,Ultra-precise AI weather forecasting.,http://atmo.ai
Living Carbon,Plants that capture and store more carbon.,https://www.livingcarbon.com
Nimbus,Tesla for city dwellers ,http://www.nimbus.green
TagMango,Monetisation tool for the Indian creator economy,https://www.tagmango.com
ToDesktop,All-in-one platform for building & releasing desktop apps,https://www.todesktop.com
Revenir,First API solution for tax returns.,https://www.revenir.ai/
Alude,We offer free software that automates bureaucracy for real-estate…,https://www.alude.com.br/
Abalone Bio,We discover antibody drugs others can't,https://www.abalonebio.com
Enveloop,Design and send messages from your app with a simple API.,http://www.enveloop.com
Polytomic,No-code data syncing between your systems,https://www.polytomic.com
MindsDB,AI that works at work. Turnkey. Private. ,https://www.mindsdb.com/
Segmed,Real-World Data for Health Innovation,https://segmed.ai
StratumAI,AI that tells mining companies where to mine to maximize profits,https://www.stratum.ai
Pulley,Pulley helps startups manage their equity and cap table,https://pulley.com
Explo,"Customer-facing analytics, lightning fast",https://explo.co/
Taiv,Taiv uses AI to make businesses TVs more entertaining & valuable.,https://taiv.tv
Letterdrop,Identify content that's driving revenue. Create more of it to grow…,https://letterdrop.com
OpenUnit,Software for managing self-storage facilities.,https://www.openunit.com/
Factored Quality,Helping 100+ brands bring all quality and compliance operations…,https://www.factoredquality.com/
Perceptive Technologies,"Automated tooth cutting for dentists using imaging, AI and robotics",https://www.perceptive.io
Tough Commerce,Shopify for construction.,http://www.toughcommerce.com
Ophelia,Medication & support to beat opioid addiction from home,https://ophelia.com
Breezeful,"An online mortgage broker. Get the best mortgage, fast.",https://breezeful.com/
Accord,"Driving execution excellence for B2B Sales, Onboarding, and CS",https://inaccord.com
Paragon,The embedded integration platform for SaaS apps.,http://useparagon.com
delt.ai,Digital banking for businesses in Latam.,https://delt.ai
Cron,Next-generation calendar for professionals and teams,https://cron.com
Hent,Hent is helping land lot developers to better manage their sales…,http://www.hent.com.br
Sayana,Affordable mental self-care for all. Acquired by Headspace Health.,https://sayana.app/
CrowdForce,"Crowdforce is an app that allows any local merchant in Africa,…",https://crowdforce.io/
Milo,The Family AI - a copilot for parents to tackle the invisible load of…,http://www.joinmilo.com
DocVita,Telehealth provider for India.,https://docvita.com
Genecis Bio,Makes guilt-free plastics from food waste,https://www.genecis.co/
Chaos Genius,DataOps Observability Platform for Snowflake,http://www.chaosgenius.io
HelpNow,India's most reliable Ambulance service. (uber for ambulances),http://www.getHelpNow.in
Kaiten,Find culinary products and experiences from great makers everywhere,http://www.onkaiten.com
NUMI,Your Startup's Design Department,https://NUMI.tech
Motion,Automate project management and business workflow with A.I.,https://www.usemotion.com/
Facio,Salary advance to employees in Brazil.,https://www.facio.com.br/
Karat Financial,Better financial services for creators,http://trykarat.com
Finlens,Modern accounting stack for businesses.,https://finlens.app
Loop Health,Modern & comprehensive health insurance plan for employees in India,http://www.loophealth.com
Aden,AI-native ERP for Operations Leaders ,https://adenhq.com/
Ditto,Manage the words across your team’s product from design to production.,http://dittowords.com
Teleo,Supervised Autonomous Heavy Equipment,http://www.teleo.ai
Handoff,AI estimator & agent for remodelers.,https://www.handoff.ai/
Tienda Crypto,Crypto Exchange and Payment API Gateway,https://www.tiendacrypto.com
Medicare Vox (fka Fair Square),Building an AI Health Insurance Agent.,https://www.medicarevox.com
Turing Labs Inc.,AI for R&D of consumer brands like P&G to develop better products,http://www.turingsaas.com
Plura (formerly Bloom Community),The social app for edge-of-culture communities,https://www.heyplura.com
Altay Therapeutics,Altay develops disease-modifying therapies targeting transcription…,http://www.altaytherapeutics.com
Ello,Building the world's first 1:1 AI teacher.,https://www.ello.com
Welcome,Create jaw dropping virtual events,http://www.experiencewelcome.com
QueryPie,Unified Access Control & Audit for Infrastructure,https://www.querypie.com
Quill,Fullstack API and management platform for dashboards and reporting,https://quill.co
Release,Environments as a service,https://release.com
Vori,Vori is a modern operating system for supermarkets,https://www.vori.com
Alloy Automation,Alloy is a platform for building and managing SaaS integrations,https://runalloy.com/
Cortex,Cortex is the Internal Developer Portal eliminating “developer tax”…,https://cortex.io/
Mini Exhibitions,Virtual events for remote teams,https://miniexhibitions.com/
Deep Meditate,"Deep Meditate is an app that helps you de-stress, sleep, and…",https://deepmeditate.com
Dropbase,Prompt-based app builder. Build back-office software faster with AI,https://dropbase.io
Candid Health,The revenue cycle automation platform.,https://www.joincandidhealth.com
Logarithm Labs,Easy button to use data for your daily operations,http://www.logarithmlabs.com
Operator Labs,"Building protocols for the intelligent, decentralized web.",http://operator.io
BuildBuddy,BuildBuddy provides enterprise features for Bazel — the open source…,https://buildbuddy.io
Fly.io,Run full stack apps close to your users.,https://fly.io
TrueNorth,TrueNorth gives truckers a single place to manage their business.,http://www.truenorthfleet.com
Nextmv,A DecisionOps platform that accelerates optimization AI teams,https://nextmv.io
Datasaur,Datasaur builds a data labeling workforce management platform for NLP.,https://datasaur.ai
H1,Connecting stakeholders across the healthcare ecosystem.,https://www.h1.co/
Dashworks,Your team's intelligent start page.,http://www.dashworks.ai
Terrasoft,,https://
Haven,Homeownership reimagined for the 21st century.,http://www.havenservicing.com
Farcast (formerly UTVATE),We build advanced satcom user terminals,https://www.farcast.com/
Replicate,Run machine learning models in the cloud,https://replicate.com
Paymobil,The super simple stablecoin wallet with free transactions,https://www.paymobil.co
StartPlaying.Games,Building Communities Through Play,https://startplaying.games/
Eze,B2B Marketplace for new & used electronics,https://www.ezewholesale.com/
Infield,"Safer, faster dependency upgrades",https://www.infield.ai
Benepass,Fintech for corporate compensation,http://www.getbenepass.com
Metaplane,Data observability for modern data teams,https://metaplane.dev
Signadot,Shift Left Testing for Microservices,https://www.signadot.com/
SINAI,Enterprise software to quantify cost-effective decarbonization…,http://www.sinai.com
Grain,Grain transforms the debit card you already have into a credit card…,https://trygrain.com/
Blair,Financing education through Income Share Agreements,https://joinblair.com/
Tandem,Tandem is a virtual office for remote and distributed teams.,https://tandem.chat
Zergo,We make a urine test that helps women get pregnant.,https://www.zergo.com/
Adla,Department store for e-commerce,http://tryadla.com
