company_name,short_description,website
NewsCatcher,News API for risk and data teams,https://newscatcherapi.com/
BiggerPicture,Scheduling automation platform between trucking and warehousing ,http://biggerpicture.co
Hype,Trade memes,https://www.hype.meme/
Apprecio,Apprecio helps grocery stores sell more and CPGs to sell fast,https://apprecio.mx/
Unlogged,Replay Production Traffic Locally and Ensure 0 Production bugs,https://unlogged.io
Illuminant Surgical,We let surgeons project x-rays directly on the patient’s skin,https://www.illuminant.ai/
Slidely AI,AI-powered PowerPoint add-in to make beautiful presentations faster.,https://slidely.ai/
Typewise,Boosting customer service and sales productivity by 2-3x.,https://typewise.app
Ajourney,Automate work with AI,https://ajourney.com
Sei,AI-powered Regulatory Compliance Platform,https://seiright.com/
Blaze,Marketing automation for the modern world,https://withblaze.app/
Axross Pte Ltd,AI-driven HVAC control system for improved energy performance,https://www.axross.co/
Nest Genomics,Software to launch and integrate genetics into clinical care,https://nestgenomics.com
Perl Street,Financing the next-generation of infrastructure projects,https://perlstreet.com/
Spinach AI,The AI Meeting Assistant,https://spinach.io
Nyckel,Classify Anything,https://www.nyckel.com
Lifted,Smartwatch powered coaching to improve teams sustainable performance,https://www.lifted.work
Fleetzero,Battery-electric cargo ships. ,https://www.fleetzero.com
Pursuit,Turnkey co-ownership & management of properties,https://www.pursuit-properties.com/
Sekilo,Poultry processing & supply chain for the SME foodservice industry.,https://sekilo.com/en/
Yezza,Storefronts on WhatsApp in Southeast Asia,https://yezza.com
CUTR,The marketplace for wood manufacturing,https://www.cutr.ai/
Sarus,"Use personal data for analytics and ML, safely and seamlessly",https://www.sarus.tech
Harmoney,Electronic bond trading platform for institutions in India,https://www.harmoney.in/
Gym Class - by IRL Studios,Play basketball in virtual reality,https://gymclassvr.com
Brown Foods,Making 'REAL' Milk without any Cows!,http://brownfoods.in/
Stably,Stably AI automates all your web E2E tests with zero-flake guarantee,https://www.stably.ai
Trébol,Business onboarding automation for banks and lenders in Latin America,https://gotrebol.com/
Wingback,Wingback provides tools and APIs for SaaS pricing and packaging.,https://www.wingback.com/
TeamOut,Online marketplace for team retreat venues,https://www.teamout.com/
Rosebud Biosciences,Growing micro-organs to find new drugs,https://rosebudbiosciences.com/
Craniometrix,We're building the one-stop-shop care platform for Alzheimer's…,https://craniometrix.com
8vdx,Scaling credit underwriting & investing with fine-tuned AI models,http://www.8vdx.com
Momento,Building a full-stack auto insurer for the underserved in LatAm,https://www.tumomento.com/
PromptLoop,AI for market research and analysis,https://www.promptloop.com/
Engage Bio,mRNA Immunotherapies to Eliminate Cancer,http://engagebio.com
Actipulse Neuroscience,Bringing non-invasive brain stimulation from the hospital to the home,http://www.actipulseneuroscience.com
FlowDeploy,Bioinformatics pipelines in the cloud,https://flowdeploy.com
Shinkei Systems,"Robots for longer-lasting, better-tasting fish at scale.",http://www.shinkei.systems
Zywa,Middle East's first neobank for teenagers and university students,https://www.zywa.co/
Loops,Email sending for startups,https://loops.so
VacationHomeRents,Kayak.com for vacation rentals,https://www.vacationhomerents.com
Transfez,Brex for small businesses in Indonesia ,https://neo.transfez.com
HomeRoom,We Rent Your Property by the Room.  You earn 50% more Rent.,https://livehomeroom.com/
Shuttle Central,Helping travel companies to sell transportation online,https://book.shuttlecentral.com/
Seabound,Carbon capture equipment for ships,http://seabound.co
Miggos,Wholesale marketplace for mom & pop clothing shops in LATAM,https://miggos.com/
Dioptra,Automated contract review with AI,https://dioptra.ai/
Viva Labs,AI Videos that Connect with People,https://www.vivalabs.ai/
Ankr Health,Virtualizing brick-mortar infrastructures of clinics w/ generative AI ,https://ankr.us
Hyperbeam,API for shared embeddable web browsers,https://hyperbeam.com?ch=yc
Valari,Embedded finance platform for LatAm.,http://valari.co
UpBanx,Brex for D2C Brands and Content Creators in Indonesia,http://UpBanx.com
Sivi,Sivi - English Speaking Practice App,https://www.mysivi.ai/
Fieldproxy,Retool for 20 Million Field Teams,http://fieldproxy.com/
Emigre,Banking in India for Indian expats (NRIs),http://www.emigre.us/
Happl,Your personalised benefits and engagement platform for global teams,https://happl.com/
Unlayer,Unlayer makes embeddable email and web editing software.,https://unlayer.com
Pyrls,Modern medical reference app for healthcare providers,https://pyrls.com
Samos Insurance,Accidental Death Insurance for Surgery ,https://www.samos.insure
Complif,Compliance tools for financial companies in LatAm KYC & AML,https://complif.com
Bobidi,Gamified Trainig For Hospitality Workers,http://www.supertalents.ai
Dynamo AI,Compliant-Ready AI for the Enterprise,https://dynamo.ai
Orca,"Banking for Gen Z, on steroids.",https://orca.fyi/
Instant Labs,Instant builds AI-powered tools to help build your business.,https://instant.ca
Invert,Data analytics software for biomanufacturing.,http://www.invertbio.com/
Koala,Minecraft for Teachers,https://www.teachwithkoala.com
Onyx Private,A modern and more accessible private bank for the new generation ,https://www.onyxprivate.com
Industrial Next,Tesla autonomous manufacturing for everyone,https://www.industrialnext.ai
Rownd,"Simple, dynamic, adaptive mobile and web app authentication",https://rownd.io
Kaso,B2B platform connecting restaurants with food suppliers,https://www.kaso.ai
Vance,Single account to manage money across the world,https://vance.tech
Vendoo,We help online sellers manage a sales business on multiple platforms. ,https://vendoo.co
Corveus Medical,Catheter-based solution to treat chronic heart failure. ,https://www.corveusmedical.com/
Touch and Pay Technologies Limited,Digitizing and processing Microtransactions in Africa,https://touchandpay.me/
Ozone,Figma for video,https://ozone.pro
Alixia,Targeting the Tumor Ecosystem to address cancer drug resistance.,http://www.alixia.com
Heyfood,Doordash for Africa,https://heyfood.africa/
HypaHub,A Cloud-Based Bioinformatics and AI Platform ,https://www.hypahub.com
Myria,A marketplace of luxury services for the ultra-wealthy,https://myria.us
Atlas,Modern customer support platform replacement for Intercom and Zendesk,https://atlas.so
Peakflo,Bill.com for SE Asia,https://peakflo.co
Winter,Credit card checkout for NFTs,https://
Rebill,Payments and subscriptions platform for Latin America,https://www.rebill.com
NFTScoring,NFT Trading Platform,https://nftscoring.com/
Flike,Flike's AI crafts sales emails that convert,https://flike.app/
Proper,Reconciliation and financial operations platform,http://www.properfinance.io
Speechly,Natural Language Understanding API for Speech that runs on device,https://www.speechly.com/
Alfie,Democratizing access to precision weight loss medications ,http://www.joinalfie.com
JumpWire,Dynamic access controls for all data and databases,https://jumpwire.io
Stackshine,Automating all IT operations,https://www.stackshine.com
Fuell,Fuell is a leading Expense Management solution that modernizes…,https://getfuell.com/
mutable.ai,Artificially Intelligent Corporations,https://mutable.ai
Joe,"We let customers ""Buy Now Pay Later"" on any store in Europe. ",http://www.joe-app.com/en
Bracket,Two-way syncs between business tools and your database,https://www.usebracket.com/
Rider,Modern parcel delivery for online sellers in Pakistan. ,http://withrider.com
Nara,Answer 70% of your support and sales questions. Instantly,https://trynara.com
Serif Health,Healthcare Price Transparency APIs and Data Products,https://www.serifhealth.com
TAI,Control All of Your Investments from a Single App,https://www.withtai.com
Botin,Investment super app for Latin America,https://www.botin.app
Instalab,Proactive Testing and Treatments,https://www.instalab.com/
Vecindario,We make it easier for real estate to sell properties and mortgages.,https://www.vecindario.com/
Demo Gorilla,Make all your live SaaS demos impactful: close more ARR faster,https://demogorilla.com/
Munily,Access control management app for Latam´s gated communities,https://munily.com/#/
Northwind,Tele-dermatology for chronic skin conditions ,https://northwindskin.com
Pelm,Plaid for utilities,https://www.pelm.com
CoffeeAI,"Instant, hyper-personalized, AI-powered outreach messages",https://www.get-coffee.ai
Cherry Recommends,Promotion management platform,https://cherry.ai/
Castia,Built Rewards for Latam. Pay Rent and get benefits.,https://www.castia.com
Whiz,"Transforming Finances, Maximizing Your Money Potential.",https://whiz.id
Supertone,Share sounds with other musicians online,https://www.supertone.com
Drivingforce,Rippling for trucking,https://www.drivingforce.co/
Bifrost,Wills and Estate Management for Crypto,https://www.hapi.finance/
Skillza,Skillza builds simple tools for teachers and schools in MEA,https://www.skillza.co
Kable,Usage-based billing for API companies,https://kable.io
Suggestr,Amazon-level personalization for Shopify merchants,https://suggestr.co
Vessel,"Developer-first, native integration platform for GTM tools",https://vessel.dev
Aklimate,Software for enterprises to track and reduce supply chain emissions,https://www.getaklimate.com/
Nophin,AI Deal Screening Analyst for Commercial Real Estate Acquisitions,https://www.nophin.com
Wagetap,"Advance next payday, and BNPL for bills",https://www.wagetap.com/
Optery,Opt out software that removes your private info from the internet,https://www.optery.com
Andi,Search for the next generation using generative AI,https://andisearch.com
LifeAt,One tool to supercharge your productivity.,https://lifeat.com
Railbird,A futures market for events.,https://www.railbirdexchange.com/
Boardcave,Building the world’s largest online surf gear store.  ,http://www.boardcave.com
Syrona Health,Support underserved Women's health journeys:Endometriosis to Menopause,https://syronahealth.com/
Hubble Network,Bluetooth to Space,https://hubblenetwork.com
Kapital Bank,Data driven neobank for SMBs in LATAM,https://www.kapital.mx
Trellus,Real-time sales coach for SDRs ,https://www.trellus.ai
WorldQL,Dreamlab.gg – AI-Native Multiplayer Game Engine for the Web,https://www.worldql.com/
Sieve,Video AI for Developers,https://sievedata.com/
PolicyFly,Modernizing Specialty Insurance,https://www.policyfly.com
Selia,Selia is an online platform connecting individuals with top-quality…,https://www.selia.co
Lumina,AI+human powered automation on job-community platform with 1.5M…,https://www.lumibot.com
Flightcontrol,"Deploy apps with utmost reliability, flexibility, and performance",https://www.flightcontrol.dev?ref=bookface
WeReno,Owner's Rep as a Service for Construction,https://wereno.com
Starling,AI enabling digital urine diagnostics in the home,https://starlingmedical.com/
Scout (formerly Uh-Oh Labs),The smart testing platform that unlocks digital health at home.,http://scouthealth.com
Nira Energy,Software to find the best sites for renewables on the electrical grid,https://www.niraenergy.com/
TYBR Health,Natural hydrogel to keep internal organs scar-free after surgery,https://www.tybrhealth.com/
Strac,"Data Discovery, DLP, DSPM for SaaS, Cloud, Gen AI & Endpoints",https://www.strac.io/
Apollo, Payments & Loyalty Infrastructure ,https://www.apollofirst.xyz/
Wyvern,High-res hyperspectral pictures of Earth from space,http://www.wyvern.space
Spot Health,At-home diagnostics as a service,https://spotdx.com
Swades AI,Applied AI Research Lab,https://www.swades.ai/
Uberduck,"Fast, professional content creation with AI audio, image, and video.",https://www.uberduck.ai
Arc,Banking & Funding for Startups,https://www.joinarc.com/
Elevate (formerly Bloom),US based USD accounts for non-US residents ,https://www.elevatepay.co
GrowthBook,Open source feature flagging and A/B testing,https://www.growthbook.io
Mederva Health,Medical expertise for everyone.,https://medervahealth.com/
StafBook,Rippling for Southeast Asia,https://stafbook.com
Compra Rápida,One-click checkout for LatAm.,https://www.comprarapida.co/
Agave,API & Data Infrastructure for Construction,https://www.agaveapi.com
Remedial Health,B2B E-commerce & Fintech platform for Pharmacies & Hospitals in Africa,https://remedial.health
AstroForge,We Mine Asteroids,https://www.astroforge.io/
Redbird,AI-powered Analytics Platform,https://www.redbird.io
Moots AI,AI-powered contact app for dealmakers,https://www.moots.ai/
Criya,AI that builds GTM assets in seconds,https://criya.co
Finnt,AI Agents for CFO and Finance teams,https://finnt.com
Cerebrium,Serverless Infrastructure Platform for AI,https://www.cerebrium.ai/
Spade,Enriched transaction data you can build on,https://www.spade.com
Fogbender,Customer support tool purpose-built for companies that sell APIs,https://fogbender.com
WishRoll,Building something new in Consumer AI,https://www.wishroll.co/
SOTERI SKIN,D2C Skincare for Eczema,https://soteriskin.com/
Unsaddl,education benefits for a modern workforce,http://unsaddl.com
QUIK,Building the operating system for business in LATAM,https://quikpago.com
Sendo,The best SMS/RCS API for startups,https://sendo.dev
Vobi,All-in-one project management software for construction SMBs in Latam,https://www.vobi.com.br
Clupp,Innovative insurance solutions for underserved markets.,http://clupp.com.mx/
Shaped,The fastest path to relevant recommendations and search,https://shaped.ai
ngrow.ai,Low-code SaaS for marketing in push notifications,http://ngrow.ai
Float Health,the marketplace for Specialty Pharma,http://float.health
amiloz,Micro-lender in Mexico,https://www.beloz.com.mx/
Ploomber,Heroku for AI,https://ploomber.io/
GoJom,One-stop-shop for Real Estate Solutions. ,https://gojom.com
yhangry,Marketplace for private chefs,http://www.yhangry.com
Arpari,Treasury management for CRE,https://www.arpari.com
Verse,Augmenting human creativity with AI,https://madeonverse.com/
Fleek,A B2B marketplace for wholesale second hand fashion,https://www.joinfleek.com/
Rally UXR,User Research CRM,https://www.rallyuxr.com/
Humand,All-in-one app for internal communication and HR,https://humand.co
WANTD,A direct to consumer marketplace and influencer network for brands,http://getwantd.com
RTHM, Simplifying complex illness care at scale,https://www.rthm.com
Unravel Carbon,Enterprise software for companies to track & reduce their carbon…,http://unravelcarbon.com
Glow Energy,Unlocking Virtual Power Plants for rental properties,https://www.glowenergy.com/
Tuesday,Scale personalized outreach with AI.,https://tuesday.so
Marathon Education,We provide live after-school tutoring to K-12 students in Vietnam,https://www.marathon.edu.vn
Decent,One-click transactions using any token across chains.,https://www.decent.xyz/
Jamsocket,Run compute-intensive apps in a browser,https://jamsocket.com
PropelAuth,Team-based authentication for B2B SaaS,https://www.propelauth.com
Topship,Flexport for African Merchants - Building the OS for Global Logistics,https://topship.africa/
Vimmerse,Bring your photos to life with Vimmerse,https://vimmerse.net
Telematica,,https://telematica.so
Theneo,Stripe-like API Docs in just a few clicks,https://theneo.io
Rome,The marketplace for truckers,https://rome.ai
Fello,Grow money and win $1000 every week by saving and playing games,https://fello.in
Kular,Replacing 20 Million Salespeople With AI,https://www.kular.ai
Bemlo,The platform for healthcare facilities to fill vacant shifts,https://bemlo.com
Ponyrun,Automate prospect research at scale,http://www.ponyrun.ai
Andson Biotech,Empowering Mass Spec for Biotech and Beyond,http://www.andsonbiotech.com
Torpedo Therapeutics,"High-precision, closed-loop neuromodulation devices",https://www.torpedotherapeutics.com
Numida,Working capital for African micro businesses,https://numida.com
PINA,WealthFront of Indonesia ,https://pina.id
Joon Health,Pediatric digital therapeutic for the +100M families in the US,https://joonhealth.co
Workflow86,AI that builds fully-configured automated business processes,https://www.workflow86.com
Top Road,Third party tools for custom GPT builders in the Open AI Store,https://toproad.ai
Cypher,Banking built with on-chain primitives for web3 founders and teams,https://cypherhq.io/
AvairSense,We go all out to Build the Smartest AI-Enabled Cameras!,https://www.avairsense.com/
Trueplace,Super assistant for service professionals.,https://www.trueplace.ca/
IoTFlows Inc,AI-Powered Machine Performance Monitoring,https://www.iotflows.com/
UNISON,"Live between worlds, in UNISON, using the headset we're building!",https://www.in-unison.com/
Venue.ink,Software for tattoo artists and studios,https://venue.ink
Attain,One-Stop Shop for Convenience Store Inventory,https://joinattain.com/
Convore,Universal conversation API for developers,https://www.convore.dev
SNAB,A global finance automation platform for complex multi-entity…,https://www.snabfinance.com/
Quan,End-to-end platform to improve wellbeing and team performance. ,https://www.quanwellbeing.com/
Better Opinions,Prediction market of India,https://betteropinions.in/
Argument Computer Corporation,Accelerate verifiable computing,https://argument.xyz
Amal Invest,Investing app for Muslims,https://amalinvest.com
Brainboard,Visually design and manage cloud infrastructures.,https://www.brainboard.co
Codec,Tools and APIs for video intelligence,https://codec.io
Mahaana Wealth,Mahaana is first & only licensed digital wealth manager in Pakistan,http://mahaana.com
Plover Parametrics,Climate change insurance that pays out immediately.,https://plover.insure
Beyond Aero,First electric business aircraft designed for hydrogen propulsion,https://www.beyond-aero.com/
KorrAI,Tracking Millimetre-Scale Movements from Space,https://www.korrai.com
Revoy,Make diesel semi trucks hybrid-electric,https://www.revoy.com
Cofactr,Cloud pre-factory logistics and procurement for electronics,https://www.cofactr.com/
Strom AI,"Create professional proposals, quotes, and documents in seconds.",https://strom.ai
beU delivery,Food delivery service in Africa,https://eat.beu.chat
Pantore Pay,Working capital for Brazilian restaurants,https://www.pantorepay.com.br
HippoBuild,The Operating System of the construction industry,https://hippo.build
Eventual,Data Warehouse for ML/AI,https://www.eventualcomputing.com
Karate Labs,Open-source API & UI test automation ,https://karatelabs.io
Phoenix Hydrogen,First commodity marketplace for hydrogen.,https://phoenixhydrogen.com/
Jutsoo,All your corporate bank accounts connected under one platform,https://www.jutsoo.com/
AiSupervision,The operating system for factory production lines,https://www.aisupervision.com
EasyCode,ChatGPT that understands your codebase.,https://www.easycode.ai/
Finnix,Financial technology solutions for Indonesian creative businesses,http://finnix.id
Seis,Banking 100% in Spanish for the 44 million US Spanish speakers,https://www.seis.com
Onboard.io,Manage & automate customer onboarding and implementation,https://onboard.io
Fresh Factory,Smart Cold Chain Fulfillment Platform,http://freshfactory.id/
Remi,"Simplifying roofing for homeowners, roofers and enterprises.",https://www.remihq.com
CrediBook,Faire for Indonesia,https://credibook.com/
Mono,A bank account that integrates LatAm SMEs' finances and operations.,https://www.cuentamono.com/
Reality Defender,Enterprise Deepfake Detection,http://www.realitydefender.com
Lizza,AI-assitant for managing creator-brand partnerships,https://lizza.link
Massdriver,"Deploy secure, scalable cloud infrastructure in minutes not days",https://massdriver.cloud
TradeX,Exchange to trade on outcome of events.,http://tradexapp.co/
WhiteLab Genomics,Unleashing the potential of DNA and RNA based therapies using AI,https://whitelabgx.com
BBy,BBy powders breast milk that's immunologically active & lasts 6 months,http://www.bbymilk.com
SimpleHash,Multi-chain NFT data platform,https://www.simplehash.com
Alima,Fresh procurement made easy,https://alima.la
Lifecast,"Software to create 3D video for VR, robotics and film.",http://www.lifecastvr.com
Pina Earth,Unlocking carbon markets for European forest owners,https://pina.earth/en
Cinapse,The Operating System of Hollywood,https://cinapse.io
Finku,Personal finance platform for Indonesia,http://finku.id
Avocademy,We teach UX/UI design and then help people get great jobs. ,http://www.Avocademy.com
AYC Fund,Online Crypto Fund,http://www.AYCFund.com/
Fortuna Genomics,Maximizing your child's potential through genetic screening.,https://fortuna.bio
Koko,Making mental health accessible to everyone.,https://kokocares.org
Reviving Mind,Addressing Loneliness and Isolation for Seniors,https://www.revivingmind.com/
haddock,SaaS helping restaurants improve their margins through cost control.,https://haddock.app
Verdn,An API to bundle trackable climate donations with any transaction.,https://verdn.com
Darsel,Chatbot teaching K12 math in developing countries,http://darsel.tech
Anja Health,Cord Blood Banking Reimagined,https://anjahealth.com
The Ankler,Subscription entertainment news,https://theankler.com
Heptabase,The visual note-taking tool for learning complex topics.,https://heptabase.com/
Netmaker,Automated WireGuard networks for distributed systems and Kubernetes,https://netmaker.io
GovDash,The AI business developer for government contractors.,https://govdash.com/
Olympian Motors,Manufacturing modular electric vehicles with style,https://olympianmotors.com/
GIMO,We help underbanked workers get paid before payday,https://gimo.vn/en
Powerhouse AI,Vision-powered warehouse automation: maximizing performance and value,https://www.powerhouseai.com
Circular,Subscription consumer electronics for Asia,https://www.nowcircular.com
Query Vary,No-Code LLM Application / Workflow Builder,https://queryvary.com
Impossible Metals,Underwater robotic vehicles that collect  battery metals responsibly,https://impossiblemetals.com
Trusty,Limitless Real Estate,https://trustyhomes.com/
Dealls – Jobs & Mentoring,Indonesia's #1 ATS & Job Portal to match top talents & companies,https://dealls.com
OffBeast,We make plant-based steaks with an authentic texture,https://www.offbeast.com
GoSats,GoSats helps you earn free bitcoin when you shop in India.,https://gosats.io
Cellbyte,Copilot for Pharmaceutical Drug Launches,https://www.cellbyte.com/
Poko,Seamless Fiat Payments for Web3,http://www.pokoapp.xyz
AirMyne,Building systems to remove carbon dioxide from air at industrial scale,http://www.airmyne.com
"Origami Therapeutics, Inc.",Oral drugs to halt neurodegeneration,http://origamitherapeutics.com
Pigeon,Simplifying loans with your friends & family.,https://www.usepigeon.io
HoyTrabajas,LinkedIn for low-skilled workers in LATAM,https://www.hoytrabajas.com/
Cashmere,Crypto wallet for web3 startups,https://cashmere.finance/
SaveIN,Making private healthcare in India accessible and affordable,https://www.savein.money/
Bakool,Group buying for Fresh in Indonesia's tier 2 cities,https://www.bakool.id
Super Send,"Super Send automates personalized outreach across email, LinkedIn,…",https://supersend.io/
Reforged Labs,AI-powered video ad creation service for indie and small game studios,https://reforgedlabs.com/
Flagright,AI-native AML compliance platform for fintechs & banks,https://flagright.com
Axis,Knowledge base for corporate affairs teams,http://axis.xyz
HOKALI,After School & Enrichment Activities Marketplace,https://www.hokali.com/
Gauss,Lower interest rates on existing credit cards,https://gauss.money
RedBrick AI,Rapid medical data annotation,https://redbrickai.com
Sphere,"AI-powered sales tax, VAT and GST compliance",https://www.getsphere.com/
BharatX,Enable Buy-Now-Pay-Later in a White-Labelled Manner,https://bharatx.tech/
Magna,Carta for Web3: token vesting and DeFi investment management. ,https://magna.so
RecordBook,Airtable for 400 Million SMBs Globally,https://play.google.com/store/apps/details?id=com.foodmonk.rekordapp
SkyLink,Travel Management Meets AI,http://www.tryskylink.com
IOMETE,The Self-hosted Data Lakehouse Platform,https://www.iomete.com/
Mintlify,The modern standard for documentation,https://mintlify.com
PermitFlow,TurboTax for Construction Permitting,http://www.permitflow.com
Stairs Financial,Find a home you can actually afford,https://stairsfinancial.com
Power to the Brand,AI Co-Pilot for Customer Support Teams,https://powertothebrand.com/
NearWave,Helping physicians select the right therapy for breast cancer patients,http://nearwave.co
IMT Care,Disrupting Indian Insurance space by empowering distrubutors,https://www.imt.care
SALT,B2B Cross-Border Payment & Compliance Platform,https://salt.pe
Siftly,Your Personal AI Data Analyst,https://www.siftly.ai/
Plumter,Easy foreign payments for African merchants,https://plumter.com
Anfin,A multi-asset trading platform dedicated to retail investors,https://anfin.vn/
digiventures,Enabling banks have a fintech-style loan origination process,https://www.digiventures.la/
Complete,The complete way to do compensation,https://complete.so
Tuva Health,Open source software that cleans and transforms messy healthcare data.,https://tuvahealth.com/
Cardda,All-in-one spend management for businesses in Latam,https://cardda.com
Streak,A neo-banking platform for children in India,https://www.streakcard.com/
Ole,Fashion shopping with delivery and return on demand,https://www.oleshop.com/
Emobi,The EV charging ecosystem that powers hundreds of businesses with AI,https://www.emobi.ai
Duplo,Venmo for B2B in Africa,https://www.tryduplo.com/
Philippo,Get instant access to cash before selling your home in Latam.,https://philippo.io/
