company_name,short_description,website
Lambda Tea,We build self-serve bubble tea dispensers! :D,http://lambdatea.com
Point API,Point stores things you send over and over again and helps you re-use…,https://pointapi.com
Ben,"The easiest way to learn about, buy, and store cryptocurrency.",https://ben.co
Iambiq Technologies,,http://www.iambiqtech.com/
Voicery,Automated voice acting and emotive speech synthesis with deep neural…,http://www.voicery.com
Correlia Biosystems,Next-gen blood testing to provide 1000x more data to pharma companies,http://www.correliabio.com
Veriff,AI-powered identity verification solution for fraud prevention.,https://veriff.com/
Replit,Collaborative in-browser IDE ,https://replit.com
Aerones,Robotics for wind turbine maintenance.,http://www.aerones.com
Substack,A place for independent writing.,https://substack.com
Volley,"Voice AI games on smart speakers, TVs, and mobile",https://volleygames.com
SafetyWing,Health insurance for remote teams,http://www.safetywing.com
Delphia,We build quantitative investment strategies improved by consumer data,http://delphia.com
Orangewood Labs,Orangewood Labs makes worlds most affordable and easiest AI robot arms,http://www.orangewood.co
Pelago,The world's first digital clinic for substance use management,https://www.pelagohealth.com
Aspire,All-in-one Finance OS for businesses,https://aspireapp.com
Mojo,Create animated social stories,https://mojo-app.com
Swayable,Swayable predicts consumer opinion and the impact of content,http://swayable.com
AlgoSurg Inc,We make AI technology for Robotic and AR Surgeries,http://www.algosurg.com
OpenSea,OpenSea is the world’s leading peer-to-peer marketplace for NFTs,https://opensea.io
OSIMple,Software for inspectors to automate their paper workflow. ,http://osimple.co
Memora Health,Digitize and Automate Complex Care Workflows,https://memorahealth.com
YouTeam,We make it easy for startups to hire engineers.,https://youteam.io
ZBiotics,ZBiotics makes genetically engineered probiotics.,https://zbiotics.com/
Helloverify,Helloverify is a background screening platform (Checkr for India).  ,https://www.helloverify.com
ArchForm,Replacing orthodontic braces with our clear aligner and software,http://archform.com
Vena Medical,Vena Medical is providing physicians with the world's smallest camera…,https://www.venamed.ca/
CaptivateIQ,"Agile commission software to design, deploy & adapt commission plans.",https://www.captivateiq.com
ErudiFi,Digital financial services for students in Southeast Asia,http://www.erudifi.com
Mind Emulation Foundation,,https://mindemulation.org/
Runa,Automating payroll for Latin America.,http://runahr.com/
Super,Super is the first and leading Indonesian social commerce platform ,http://superapp.id/
Callisto,"We create tech to combat sexual assault, support survivors, and…",https://www.projectcallisto.org
Tarjimly,Translating for Humanity,https://tarjimly.org
Observe.AI,Contact center AI platform.,https://observe.ai
Culture Biosciences,We grow cells for biotech companies.,https://culturebiosciences.com
Anjuna,Anjuna enabled organizations to trust any infrastructure,https://www.anjuna.io
Covetly,"#1 Collectibles Marketplace: Authentic Vinyl Toys, Comics, Funko Pop ",https://www.covetly.com/
Greo,Greo is a mobile video app for conversations about current events. ,http://www.greo.com
Sixty,On demand web app help,https://usesixty.com/
Value Voting,Platform to defeat political extremism through strategic primary…,https://www.valuevoting.com
Passerine Aircraft,Passerine Aircraft is building the next generation of dronesWe are…,http://www.passerineaircraft.com/
Sunfolding,Sunfolding builds next generation infrastructure for solar farms.  By…,http://www.sunfolding.com
Prism Labs,,https://
Gameday,Play fantasy sports with friends on Facebook Messenger,http://playgameday.com
Semantix,AI for medical billing,https://www.semantix.ai
Dropleaf,Subscription service for all you can play indie PC games. ,https://dropleaf.io
Caelum Health,Caelum Health is replacing drugs with software. We use behavioral…,https://caelumhealth.com/
Candidate.ly,The digital storefront for staffing and recruiting teams.,https://candidate.ly/
Slik,Slik enables the long tail to use email outreach. ,http://slik.ai
bxblue,bxblue is a marketplace for people with guaranteed income in Brazil.…,http://www.bxblue.com.br
LotusPay,Recurring payments solution for businesses in India.,http://www.lotuspay.com
Eduflow,Create and run collaborative online learning experiences.,https://www.eduflow.com
Opearlo,Opearlo produces voice apps for Amazon Alexa and Google Home.,https://www.opearlo.com
Templarbit,Protecting applications from malicious activity,https://www.templarbit.com
Headstart,Headstart uses Machine Learning to help companies decide on who to…,https://www.headstart.io
Lyrebird,Our tech speaks for itself.,https://lyrebird.ai/
disclosures.io,The Complete Listing Toolkit for the New Era of Real Estate,https://disclosures.io
FAZZ,All-in-one Finance for Every Southeast Asia Business,https://fazzfinancial.com/
Jerry,Jerry makes it really easy to save time and money on car expenses. ,https://getjerry.com
Long Term Stock Exchange,LTSE is an ecosystem for visionary business.,http://ltse.com
Gamelynx,Easily watchable cross-platform competitive games.,https://gamelynx.gg
BillionToOne,The genetic testing platform detecting and measuring disease.,https://www.billiontoone.com
Skyways,Creating a new form of air transportation.,http://skyways.com
PullRequest,Code review as a service - combining automation with a network of…,http://www.pullrequest.com
Dharma Labs,The easiest way to buy 74k+ crypto tokens with USD,https://dharma.io
Nobell Foods,Cheese and dairy products from plant-derived dairy proteins,http://www.nobellfoods.com
VergeSense,AI-Powered Building Management,http://www.vergesense.com
Leon & George,Buying and owning indoor potted plants made easy.,https://www.leonandgeorge.com
Releaf,Supply chain technology that provides inputs to African FMCGs,http://www.releaf.africa
Ribbon Health,"Health enterprise API for data on doctors, insurance, costs, & quality",http://www.ribbonhealth.com
Bloom Institute of Technology,The online coding school that invests in you.,https://www.bloomtech.com
Aecore,Vertically integrated commercial construction,https://www.aecore.com
Fam,Video calling social network to talk with friends and make new friends,https://www.famapp.com/
VIDA & Co.,Platform for unique products produced on-demand at mass-scale,http://www.shopvida.com
Surematics,We help commercial insurance brokers structure complicated…,https://www.surematics.com/
Guilded,Chat for gaming communities,http://www.guilded.gg
Indivio,Customize videos to be more relevant and improve business outcomes.,https://www.indiv.io
PreDxion Bio,"Rapid, scalable diagnostic for SARS-CoV-2 and beyond",http://www.predxionbio.com
Guggy,"Guggy is building the messaging app of the future with real time,…",https://guggy.com
Social Construct,Social Construct designs and assembles large apartment buildings …,http://socialconstructco.com
Commissary Club (formerly 70 Million Jobs),Social network for 70 million Americans with criminal records.,https://www.Commissary.Club
Cambridge Cancer Genomics,CCG.ai empowers clinicians to make personalised treatment strategies…,http://ccg.ai
Bumpline,Captain Tailor is the Uber for tailoring. ,https://bumpline.com/
AutoHub,We help dealerships appraise vehicle trade-ins more efficiently…,https://www.autohub.io
Elucd,Polling through mobile ads to enable governments to make better…,http://www.elucd.com
WheelStreet,WheelStreet is a Motorbike rental marketplace that connects…,https://www.wheelstreet.com/
Audm,Audm is a subscription service providing mini-audiobooks —…,https://www.audm.com
NextDrop,NextDrop is the water marketplace for urban India.  We connect water…,https://thenextdrop.com/
Feather,Furniture rental for consumers and businesses.,http://livefeather.com
Py,Py is democratizing access to career opportunities in tech,https://www.getpy.com
Fat Llama,Fat Llama is the first fully insured peer-to-peer rental marketplace.…,https://fatllama.com
Mystery.org,We help kids stay curious by creating better explanations.,https://mystery.org
CarDash,Managed marketplace for automotive services. ,https://www.repairsmith.com
Escher Reality,The backend for Augmented Reality.,http://www.escherreality.com/
Meetingbird,Automated meeting scheduling for teams,https://www.meetingbird.com
Wildfire,Social news app,http://getwildfire.com/
Solve,"We save travelers hours by meeting them at their arrival gate,…",https://www.solve.com
Enzyme,Automating regulatory approval & compliance for life science companies,https://www.enzyme.com
Plasticity,Natural language processing APIs for developers.,https://www.plasticity.ai
Truepill,API-connected healthcare infrastructure.,https://truepill.com/
Percept.AI,AI support agent for your business that actually works,https://www.percept.ai/
Honeydue,"The simplest way for couples to manage money, together",https://www.honeydue.com/
Helium Health,Africa's #1 healthcare technology provider.,https://heliumhealth.com/
UpCodes,UpCodes helps the AEC industry deliver code compliant buildings,https://up.codes/
Standard AI,AI-powered checkout for retail.,https://standard.ai
Pathrise,YC for your career,https://www.pathrise.com
Advano,Advano is a battery technology company that improve the longevity of…,http://www.advano.io
Officely,Building next generation tools for the hybrid workplace,https://www.getofficely.com?utm_source=yc
May Mobility,Transforming cities and rural areas through AV transit and technology,http://maymobility.com
AssemblyAI,APIs for AI models,https://www.assemblyai.com
Zendar,We make high definition radar allowing self-driving cars to see in…,http://www.zendar.io
Routable,Simplifying payouts at scale,https://routable.com
Cashfree Payments,Next-gen digital payments provider for India.,https://www.cashfree.com/
Just Appraised,Just Appraised makes software for local governments.,https://www.justappraised.com
Thematic,We analyze feedback to help companies improve customer loyalty,http://www.getthematic.com
10 By 10,10by10 is a unique marketplace in the recruiting agency industry for…,https://10by10.io
Forever Labs,"We bank your stem cells to help you live healthier, longer.",https://foreverlabs.com
Fastpad,Hiring Software for India,https://fastpad.com/
Polly,Polly is a social polling app for Snapchat and Instagram stories. ,https://polly.fun/
Gem,Talent engagement platform,https://www.gem.com/
FollowUpThen,FollowUpThen is an email-based personal assistant that sends you…,https://www.followupthen.com/
Modern Fertility,At-home fertility test for women who aren't ready for kids right now…,https://www.modernfertility.com
Flock Safety,The first public safety operating system that eliminates crime.,http://www.flocksafety.com
Sunu,Audio and Haptics AR interface equipping blind users with super powers,http://www.sunu.com
WATERFX,The world's first 100% sustainable water provider (aka alternative…,http://www.wacomet.com
And Comfort,And Comfort is a direct to consumer fashion brand for plus-size…,http://andcomfort.com
Storyboard,Social media management tool for Instagram and Snapchat,https://www.storyboard.com
Goosebump,Find the best electronic music events in a single message.,http://m.me/higoosebump
Modular Science,We're making it easier to do sustainable farming.,https://www.modularscience.com/
RideAlong,We save lives by giving police and health workers key info to safely…,http://www.getridealong.com
Mystro,Mystro is an app that makes rideshare drivers up to 30% more money by…,http://www.mystrodriver.com
Oncobox,Finding the right cancer drug for each patient. ,http://oncobox.com
OneLocal,OneLocal is a CRM for local businesses.,https://onelocal.com/
Muzz,Where Single Muslims meet,https://muzz.com
Goodcover,"Digital Co-op Renters Insurance = half the price, better coverage.",http://www.goodcover.com
Roofr,Sales software for roofers. Aerial measurements + proposals in seconds,https://roofr.com/
Nimble,Data-driven teacher hiring,http://www.hirenimble.com
Carrot Fertility,Customized fertility benefits for modern companies. ,https://www.get-carrot.com/
SafeButler,Your chief servant for shopping insurance,https://www.safebutler.com
Prelim,Software for banks to open bank accounts,https://prelim.com/
Darmiyan,Early detection of Alzheimer's disease,https://www.darmiyan.com/
ThereCraft,,https://therecraft.com
Relationship Hero,Dating & relationship coaching sessions for individuals and couples,https://relationshiphero.com
CocuSocial,Marketplace for local activities.,http://www.cocusocial.com
Skyscrape,Skyscrape makes temperature-responsive insulation,http://skyscrape.us
Koko,Koko Labs makes the most effective cure for insomnia,https://www.meetkoko.com
Entocycle,Automated factory to produce insect protein for farm animals. ,https://www.entocycle.com/
Upfort,Turnkey security & hassle-free cyber insurance from leading insurers,https://www.upfort.com
Spect,Value-based retinal screening in primary care to prevent blindness. ,http://www.getspect.com
D-ID,Enable creators and developers to generate realistic AI personas,http://www.d-id.com
Tesseract,Tesseract builds better thrusters for modern satellites,http://tesseract.space
Pop Meals,Pop Meals is a restaurant chain without chefs. All recipes are…,https://popmeals.com
Flowspace,The operating system powering ecommerce fulfillment,http://www.flow.space
Airthium,Decarbonized heat and power cheaper than fossil fuels,http://www.airthium.com
Imbue,,http://imbue.com
Piggy,"App for Indians to make investments in mutual funds, manage their…",https://piggy.co.in
Pyka,Autonomous electric airplanes,https://flypyka.com
Rev Genomics,Rev is a biotechnology company creating better plants.,https://www.revgenomics.com
HelpWear,,http://helpwear.ca/
Rabbet,"Bringing efficiency, accuracy and transparency to construction finance",http://rabbet.com
tpaga,First financial Superapp of Latin America,https://tpaga.co/
Riley,MailChimp for SMS ,https://getrileynow.com
Trade,We're building Africa's Commodity Exchange. ,http://www.tradeghana.co
Cowlar,Fitbit for dairy cows. Farms use cowlar's alerts & recommendations to…,http://www.cowlar.com
Pearl,The future of office coffee.  Keurig convenience meets cafe quality. ,https://getpearlcoffee.com/
Pit.AI,Solving intelligence for investment management.,https://www.pit.ai
boxouse,"portable, affordable, beautiful smart homes",http://boxouse.com
LitHit,Smart Target for Shooting Sports,http://lithit.com
Tetra,AI notetaker for phone calls,https://asktetra.com
Zinc Platform,Insurance Distribution Infrastructure,http://www.zincplatform.com
VoiceOps,VoiceOps is a platform for analyzing enterprise voice. Our mission is…,https://voiceops.com
Terark,"Fastest Storage Engine with the Best Compression, we enables direct…",http://www.terark.com
KidPass,Online & In-Person Kids Activities,https://kidpass.com
Peer5,P2P delivery network that enables high quality video streaming,https://www.peer5.com
Playment,Mechanical Turk for enterprises.,https://playment.io/
ScopeAI,Automatically extract valuable insights from customer service…,https://www.getscopeai.com
Tizeti,ISP for Africa,http://www.tizeti.com
Speak,"A superhuman, AI-powered language tutor in your pocket",http://speak.com
Bountiful,An Operating System for agriculture.,https://bountiful.ag/
MDalgorithms Inc.,Democratizing Dermatology with AI ,https://www.mdalgorithms.com/
BloomAPI,BloomAPI helps doctors share clinical data. Today most healthcare…,https://www.bloomtext.com
Sinovia Technologies,Flexible printed OLED displays.,http://www.sinoviatech.com
Loop Support,Predict job applicant performance for entry-level support roles,https://www.loopsupport.com/
Sleep Reset,Sleep Reset is a clinically proven CBT-i program for better sleep,https://www.thesleepreset.com/?utm_source=yc
Extern,"Professional Experience Anytime, Anywhere.",http://www.extern.com
REZI,Rent Better,https://www.rentrezi.com
Ledger Investing,Marketplace for insurance securitization.,https://ledgerinvesting.com/
Beek,Leading audio subscription platform for Spanish content and creators,https://www.beek.io
Nuvola,10x power coin batteries for reliable connectivity on IoT trackers,http://www.millibatt.com
ZipX,We allow anyone in South East Asia to instantly order any product…,https://zipx.com/
Sandbox Banking,Low-code integration platform for banking,https://sandboxbanking.com
Armory,"Continuous Deployment at any scale, for all developers.",http://armory.io
Supr Daily,Daily grocery delivery service in India,http://www.suprdaily.com/
Voodoo Manufacturing,AWS for manufacturing.,http://www.voodoomfg.com
SourceBeacon,SourceBeacon is an on-demand procurement concierge for sourcing…,https://www.sourcebeacon.com
Anasen,Anasen is an app that makes data analysis easy and accessible to…,http://www.anasen.com
Clear Genetics,Clear Genetics is scaling delivery of Genomic services,https://cleargenetics.com/
Niles,Knowledge Assistant for Work.,https://niles.ai
No Lean Season,A bus ticket out of poverty,http://
Scribe,Scribe is an AI based Sales Development Representative that you can…,http://tryscribe.com/
lvl5,HD maps for self-driving cars.,http://www.lvl5.ai
Wavy,Experience music and art in augmented reality,http://downloadwavy.com
Volansi,Autonomous VTOL delivery solutions.,https://flyvoly.com/
Soomgo,Local services marketplace that connects providers with new customers,https://soomgo.com
Shipamax,"Simple, end-to-end automation for logistics orgs",https://shipamax.com
Arthena,Quantitative Investment in Art Assets ,https://www.arthena.com
Fiix,"Fiix sends expert auto mechanics to your home, so you don’t have to…",http://www.fiix.io
Scaphold.io,The Universal API,https://scaphold.io
Bulletin,Helping retailers discover and shop the best brands on the planet,https://bulletin.co
Hivy,An end-to-end platform for office management. We enable office…,https://hivyapp.com
WaystoCap,We are Alibaba of Africa. We are building a marketplace for African…,https://waystocap.com
Penny,Penny makes keeping track of your finances as easy as having a…,https://www.pennyapp.io
Breaker,A podcast company.,https://www.breaker.audio
RankScience,Automated SEO for Startups,https://www.rankscience.com
The Essential,E-commerce 2.0,http://www.theessential.com
Upcall,Upcall provides outbound call professionals as a service. ,https://www.upcall.com
The Centre for Effective Altruism,We're your non-profit portfolio managers. We make giving to…,http://effectivealtruism.org
OneFin,Shopify for Financial Services,https://www.onefin.in
Delee,Blood testing device for early diagnosis of cancer and treatment…,http://www.delee.co    
NanoNets,Automatic Data Extraction,https://nanonets.com
"Wifi Dabba, Inc.",Decentralised broadband connectivity.,https://dabba.com
UpKeep,Mobile-first software for maintenance teams.,https://www.upkeep.com/
Indee Labs,"Enabling T cell immunotherapy discovery, development and manufacturing",http://www.indeelabs.com
Dost Education,Getting kids ready for school in India.,http://www.dosteducation.com/
"Lively, Inc.",Modern employee benefits & health savings account (HSA) provider,https://livelyme.com
Helix Nanotechnologies,"Next-generation mRNA platform to solve cancer, COVID and climate.",http://helixnano.com
Clipboard Health,Connects healthcare facilities with nurses nearby.,https://www.clipboardhealth.com/careers
Retool,Build internal tools fast.,https://retool.com
Humi,"Payroll, HR, and Health Benefits for Canada's SMB's",http://www.humi.ca
Mirror AI,App that turns selfie photos into thousand emoji that look like you…,http://mirror-ai.com
ACLU,Defender of rights and liberties,https://www.aclu.org/
Brex,"Business accounts, corporate cards, and spend management software.",https://www.brex.com
Faire,The global online platform empowering independent retail.,https://www.faire.com/
Rippling,"One place to run all your HR, IT, and Finance. Globally.",http://rippling.com/
Sigma Genetics,Sigma Genetics is a biotechnology company that is building…,http://www.sigmagenetics.com
BIOS Health,Neural interfaces to understand and use nerve data in medicine.,https://www.bios.health
BuyPower,Modern bill payment platform for African businesses and consumers.,http://www.buypower.ng
Smart Alto,Easiest way to set appointments with real estate leads  ,http://www.smartalto.com
Nomba,Banking and payment services for small businesses in Nigeria,https://nomba.com
"Veryfi, Inc.",APIs to Liberate Trapped Data in Unstructured Documents,https://www.veryfi.com/
Token Transit,Complete fare payment platform for public transportation,https://tokentransit.com
Ambient.ai,AI company transforming enterprise physical security to prevent…,https://ambient.ai
Mednet,Stack Overflow for Medicine,https://www.themednet.org
Aella,Diversified credit infrastructure powering payments across Africa.,http://www.aellaapp.com
Snappr,Snappr is the one-stop-shop for visual content creation,https://www.snappr.com
Wright Electric,Boeing for electric planes,http://www.weflywright.com
Tolemi,Data integration & insights for state and local governments,http://www.tolemi.com
Inboxbooster,We Fix Email in Spam,https://www.inboxbooster.com
FloydHub,"ML Platform for developing, training and deploying ML models",http://www.floydhub.com/
Collectly,We help healthcare orgs collect more money faster,http://collectly.co/
Request Network,Request is a payment request technology & an ecosystem of apps,https://request.network
AlemHealth,AI Radiologist in a Box - We provide a vertically integrated AI…,https://www.alemhealth.com
Solugen,Decarbonizing the chemicals industry.,https://solugen.com/
Bitrise,Hosted Continuous Integration and Delivery for mobile apps,https://bitrise.io
Plane,#1 easiest-to-use payroll for startups,https://plane.com
Hogaru,Hogaru is a tech-enabled home services platform in Latin America. ,https://www.hogaru.com/
Reliance Health,We make healthcare in emerging markets affordable and accessible,https://www.getreliancehealth.com
AON3D,Additive Manufacturing with advanced materials,https://www.aon3d.com
Apozy,Apozy makes every website safe to browse,https://www.apozy.com/
Bulk MRO Industrial Supply,Full Stack Fintech and Supply Chain Platform for Global Trade,http://www.bulkmro.com
Pulse,Electronic Medical Records for India,http://www.getpulse.care/
Neema,"Neema is an app for unbanked workers, which provides a checking…",http://getneema.com/
Firsthand,"Firsthand makes software-enabled, self-serve retail kiosks that carry…",http://shopfirsthand.com/
InnaMed,At-home blood testing: measure + analyze + enhance.,http://www.InnaMed.com
Entry,Biometric sign in and identity verification platform,http://getentry.com
VanGo,Uber for Kids,https://www.ridevango.com
Origin,Keurig for healthy smoothies.,http://eatorigin.com
Tress,Tress is a social community for black women's hairstyles. We are…,https://www.tressapp.co
Cartcam,"Cartcam is an app for opinionated, deal-seeking shoppers.  It gives…",https://www.cartcam.com
Bicycle AI,Bicycle AI provides customer support as a service. We work on top of…,http://bicycleai.com
Fibo,SaaS calendar and messaging for SMBs,http://www.fiboapp.com
Volt Health,Volt Health is developing medical devices that deliver electrical…,https://www.volthealth.com/
Marketfox,Marketing automation platform optimized for mobile and web. ,https://marketfox.io
Rally Tennis,Join tennis league and play competitively with people nearby,https://www.rallytennis.com/
Sycamore,Marketplace for companies to add a delivery driver in 5 minutes.,https://www.mysycamore.com/
Sudden Coffee,Crystallized coffee that's better than fresh Starbucks,https://www.suddencoffee.com/
Arylla,"We connect products to the internet using an invisible, chip-less tag",http://www.arylla.com
Class Central,Make informed online learning decisions,https://www.classcentral.com/
Edoome,Edoome is a social learning platform focused on teachers and students…,http://www.edoome.com
Kaymbu,,http://kaymbu.com
Edpuzzle,Make any video your lesson.,https://edpuzzle.com
Plickers,Data without devices,http://www.plickers.com
Showbie,Showbie is a lighter learning management system designed for schools…,http://www.showbie.com
Accredible,Digital credentials to recognize achievement,http://www.accredible.com
Literably,Early literacy assessment software for elementary schools,https://literably.com
Kodable Education,Kodable Education teaches kids how to code before they can read.,https://www.kodable.com
Securly,,http://www.securly.com
NoRedInk,,http://www.noredink.com
Classkick,More Tries For Kids,http://www.classkick.com/
Informed K12,Workflow software to help districts keep up with the pace of change…,http://www.informedk12.com
Kaizena,,http://www.kaizena.com
DeansList,Enterprise SaaS software helping schools manage administrative and…,http://www.deanslistsoftware.com
Formative,,http://www.goformative.com
TeachMe,,http://www.mathgames.com
KickUp,,http://www.kickup.co
The Rumie Initiative,We’re a non-profit that brings the best free learning content…,http://www.rumie.org
Allcancode,Get your product idea to market in weeks,https://www.allcancode.com
Next Tech,Helping you build what's next in tech. Learn top tech skills with…,https://next.tech
Sown To Grow,,http://www.sowntogrow.com/
Sense Education,"AI Platform for personalized, high-quality, actionable feedback",http://www.sense.education
Swing Education,Swing Education is the on demand workforce for schools. We make it…,http://www.swingeducation.com
ProjectPro,We are a work-acceleration platform - we help Data Scientists get…,https://www.projectpro.io
Mosa Mack Science,,http://www.mosamack.com
Tickle,,http://tickleapp.com
Trinket,"Trinket makes it easy for teachers and students to create, edit and…",http://trinket.io
