,company_name,short_description,website,direct_mentions_count,direct_mentions,all_search_results
0,Subtrace,Chrome DevTools for your backend,https://subtrace.dev,,None,"[SearchResult(url=https://www.reddit.com/r/gamedesign/comments/lb3vyt/design_by_subtraction/, title=Design by Subtraction : r/gamedesign, description=It's the idea of stripping away (subtracting) every part of your game that doesn't add to the intended experience.), SearchResult(url=https://www.reddit.com/r/AndroidClosedTesting/comments/1gihjka/app_is_rejected_again_this_is_frustrating/, title=App is rejected again, this is frustrating., description=App is rejected again, this is frustrating. this is the 2nd time my app gets rejected google should find ...), SearchResult(url=https://www.reddit.com/r/AndroidClosedTesting/comments/1gnxri3/i_need_more_testers_for_5_days_can_you_help_me/, title=I need More Testers for 5 Days. Can you help me?, description=Hi I need testers to test my app can you join group after that install my app, i will installs yours too. Thank you!), SearchResult(url=https://www.reddit.com/r/AndroidClosedTesting/comments/1gnzkpj/need_testers_for_my_new_application/, title=Need testers for my new application : r/AndroidClosedTesting, description=5K subscribers in the AndroidClosedTesting community. A sub for Android developers to post Play Store links for testing.), SearchResult(url=https://www.reddit.com/r/AndroidClosedTesting/comments/1gpalfm/my_app_got_approved_and_published_thank_you_guys/, title=My App got approved and published. Thank you guys. i will ..., description=4.8K subscribers in the AndroidClosedTesting community. A sub for Android developers to post Play Store links for testing.), SearchResult(url=https://www.reddit.com/r/AndroidClosedTesting/comments/1gollw5/help_me_promote_to_production_will_test_back/, title=Help me promote to production. Will test back, description=Hi there I am looking for testers to be able to promote my app to production. I will test your app if needed.), SearchResult(url=https://www.reddit.com/r/AndroidClosedTesting/comments/1gop47k/need_testers_for_my_closed_testing_will_test/, title=Need testers for my closed testing | Will test yours back, description=Hello! As a developer of the app we are really interested if you can test our app, let us your groups and links in order to test yours too.), SearchResult(url=https://www.reddit.com/r/macapps/comments/1bmo3kj/app_to_keep_track_of_subsrciprtions/, title=App to keep track of subsrciprtions : r/macapps, description=Collections. Use it to track subscriptions and anything you can think of. It is a database app to organize anything.), SearchResult(url=https://www.reddit.com/r/AndroidClosedTesting/comments/1gg5nw9/please_test_and_leave_a_review_for_the_app_i/, title=Please test and leave a review for the app I created. I'll do ..., description=Please install my app, keep it for 14 days, and leave a review afterward! I'll do the same for your app, keeping it for 14 days before ...), SearchResult(url=https://www.reddit.com/r/macapps/comments/1grsxhy/the_best_subscription_tracking_app/, title=The Best Subscription Tracking App : r/macapps, description=I use an app from Touchbits, Inc. It's called (wait for it) Subscriptions, and it cost either $1.99 a year or $7.99 for a lifetime purchase ($14.99 for a ...), SearchResult(url=https://www.reddit.com/r/AndroidClosedTesting/comments/1giiez5/need_testers_for_app_will_test_yours_in_return/, title=Need testers for app. Will test yours in return!, description=... subtrack. Upvote 1. Downvote Reply reply. Award ... fatherdev.badr.alturky.quran. Upvote 1. Downvote Reply reply), SearchResult(url=https://www.reddit.com/r/AndroidClosedTesting/comments/1gu3pgk/subtrack_released_thanks_a_lot_i_will_help_you/, title=SubTrack Released! Thanks a lot, I will help you!, description=SubTrack Released! Thanks a lot, I will help you! Hello everyone ... https://play.google.com/apps/testing/com.enzodev.fondosdepantalla.), SearchResult(url=https://www.reddit.com/r/AndroidClosedTesting/comments/1gea4zn/looking_for_some_more_testers_please/, title=Looking for some more testers please., description=4.9K subscribers in the AndroidClosedTesting community. A sub for Android developers to post Play Store links for testing.), SearchResult(url=https://www.reddit.com/r/HonkaiStarRail/comments/1grm6ac/dot_player_mood_for_the_new_pf/, title=DoT player mood for the new PF: : r/HonkaiStarRail, description=... subtrace unlocked). Kafka E0S0 (GNSW S3). Aventurine E0S1. Blackswan E0S1. Comment Image. The blessing chosen was the second one that explodes ...), SearchResult(url=https://www.reddit.com/r/androidapps/?after=dDNfMWd1MmxueA%3D%3D&sort=hot&t=DAY, title=r/androidapps, description=Try this app! Tired of losing track of your payments? With Subtrack, manage all your ... DEV. Upvote 0. Downvote 0 Go to comments), SearchResult(url=https://www.reddit.com/r/ableton/comments/vo4bnl/your_most_useful_max4live_device/, title=Your most useful MAX4Live device? : r/ableton, description=I regularly use a M4L device I wrote called Exclusive Subtrack. Toss it on a group track, and it only allows one of the sub-tracks in the ...), SearchResult(url=https://www.reddit.com/r/apple/comments/iemvoi/introducing_subtrack_track_your_subscriptions_and/, title=Introducing Subtrack - Track your subscriptions and never ..., description=As an iOS dev myself who's been apprehensive about adding iCloud syncing to my own hobby apps - how much work is/was it to support iCloud sync?), SearchResult(url=https://www.reddit.com/r/ProgrammerHumor/comments/t513tc/ive_learned_quite_a_lot_of_things_with_those_posts/, title=I've learned quite a lot of things with those posts, description=2.9K votes, 213 comments. 4.1M subscribers in the ProgrammerHumor community. For anything funny related to programming and software development.), SearchResult(url=https://www.reddit.com/r/ffmpeg/comments/17d4alb/converting_a_software_transcoding_ffmpeg_command/?tl=fr, title=conversion d'une commande ffmpeg de transcodage ..., description=... subtrack:force_style='Alignment=2,PrimaryColour=&H03fcff ... ffmpeg -vaapi_device /dev/dri/renderD128 -i S01E001_ducktales.mkv ...), SearchResult(url=https://www.reddit.com/r/gamemaker/comments/1dnku9n/sequences_feel_halfbaked/, title=Sequences feel half-baked... : r/gamemaker, description=... subtrack sprite graphic named spr_my_thing that you want to setthe image index of? ... Solo dev here, destroy the trailer for my first game please ...), SearchResult(url=https://www.reddit.com/r/daggerheart/comments/1cqbyx5/insight_check_does_daggerheart_have_an_identity/, title=Insight Check | Does Daggerheart have an Identity Crisis?, description=For me, if something's best element is that it's different for the sake of being different or because it has a disjointed design ... subtrack a 0- ...), SearchResult(url=https://www.reddit.com/r/googlecloud/comments/nqxaaq/billed_for_nearly_200_during_what_i_belived_was/, title=Billed for nearly $200 during what I belived was the free ..., description=... subtracing of course, those 173€, how reasonable, I couldn't have ... The goto subreddit for Google Cloud Platform developers and enthusiasts.), SearchResult(url=https://www.reddit.com/r/macapps/comments/1bcbmc8/indie_app_sales_starting_now_soon/, title=Indie App Sales starting now / soon : r/macapps, description=Subtrack: Track Subscriptions - Subtrack Pro Lifetime $2.99 (50% off!) ... If only someone would contact the dev and have them fill out the ...), SearchResult(url=https://www.reddit.com/r/GameAudio/comments/1dbzr45/weird_wwise_behavior/, title=Weird Wwise behavior : r/GameAudio, description=... subtrack every time. Any insights are appreciated. Upvote 1 ... Solo dev here, destroy the trailer for my first game please, because ...), SearchResult(url=https://www.reddit.com/r/subnautica/comments/1fqa4rd/play_again_or_bz/, title=Play again or BZ? : r/subnautica, description=Most other criticisms are subjective, such as aesthetics and story and creature design etc. ... subtrack modules, and the new biomes are pretty ...), SearchResult(url=https://www.reddit.com/r/reactjs/comments/1cjfqax/my_recent_experience_in_a_technical_interview/, title=My recent experience in a technical interview. : r/reactjs, description=I think there is more and more people that think of themselves as “react dev” instead of “frontend dev”. ... My logic was subtracing each ...), SearchResult(url=https://www.reddit.com/r/Tyranids/comments/1dk92hz/dataslate_is_up_massive_changes_yo_tyranids/, title=Dataslate is up, massive changes yo tyranids, description=... subtract 2"" from their move if they pivot/rotate at all during ... dev wounds or movement changes that are mentioned in the article.), SearchResult(url=https://www.reddit.com/r/Reaper/comments/11lp4rz/my_attempts_to_switch_to_reaper_or_any_daw/, title=My attempts to switch to reaper (or any DAW), description=Some of the issues you have can't be addressed - you can't send from a folder to a subtrack because those tracks are sending back to the folder.), SearchResult(url=https://www.reddit.com/r/ffmpeg/comments/17d4alb/converting_a_software_transcoding_ffmpeg_command/, title=converting a software transcoding ffmpeg command to VAAPI, description=... subtrack:force_style='Alignment=2,PrimaryColour=&H03fcff ... ffmpeg -vaapi_device /dev/dri/renderD128 -i S01E001_ducktales.mkv ...), SearchResult(url=https://www.reddit.com/r/ableton/comments/1cb6gws/standard_worth_the_money_compared_to_intro_as_a/, title=Standard worth the money compared to intro? (as a non- ..., description=I make electronic music with lots of sound design. ... It's not a problem, because Ableton's instrument rack creates a subtrack for each element ...), SearchResult(url=https://www.reddit.com/r/computerscience/comments/g283h8/does_anyone_know_what_this_guy_means_by_negetive/, title=Does anyone know what this guy means by, negetive 4 in ..., description=... subtract that from 256 (the next bit value after 128). So you get ... How do kernel developers write C? 101 upvotes · 82 comments. r ...), SearchResult(url=https://www.reddit.com/r/RaidShadowLegends/comments/1bd6s75/need_to_know_if_i_can_addsubtrack_someone_from_my/, title=Need to know if I can add/subtrack someone from my cb ..., description=I average 13 mil vs brutal boss. I used two keys right now and I'm going to get the full bonus but I kinda wanna see if I can add someone ...), SearchResult(url=https://www.reddit.com/r/macapps/comments/uex5uf/what_finance_apps_do_you_all_use/, title=What finance apps do you all use? : r/macapps, description=The developer is open to suggestions and features requests. https://apps.apple.com/us/app/subtrack-track-subscriptions/id1519946553. Upvote 0), SearchResult(url=https://www.reddit.com/r/rpg/comments/23yz77/rp_or_g/, title=RP, or G? : r/rpg, description=I like the character development, story arc, and general feeling of accessing my imagination. ... I like rolling dice and adding/subtracing ...), SearchResult(url=https://www.reddit.com/r/csharp/comments/41ojvk/question_about_threads_and_blocking_calls/, title=Question About Threads and Blocking Calls : r/csharp, description=I made a test program that just added and subtraced numbers in one ... Desktop developer feeling confused about “web app is the future” trend.), SearchResult(url=https://www.reddit.com/r/gamedev/comments/4sywpi/sdl2_viewport_issue_driving_me_insane/, title=SDL2 viewport issue driving me insane : r/gamedev, description=In regards to your camera system I believe you still have to subtrack ... Im not a game dev if i only contribute the artwork. Opinion? 406 ...), SearchResult(url=https://www.reddit.com/r/pcgaming/comments/1gxfx2h/dublin_firm_behind_baldurs_gate_game_posts_249m/, title=Dublin firm behind Baldur's Gate game posts €249m profit ..., description=Hasbro probably takes $10-15 for licensing. Larian receives at most half of the money you pay for the game. Then you subtract dev and ...), SearchResult(url=https://www.reddit.com/r/PhasmophobiaGame/comments/17beiys/i_dont_care_how_many_times_its_been_said_who_ever/, title=I don't care how many times its been said, who ever ..., description=if you want to subtract gear, you need everything you want to subtrack positive. ... dev team. Other games have done this. You can literally copy ...), SearchResult(url=https://www.reddit.com/r/forhonor/comments/1eih84c/would_you_rather_new_skins_new_set_of_armor_for/, title=Would you rather new skins? new set of armor for newer ..., description=I know wed like to believe that for honor has unlimited resources but these hero skins bring nothing to the game and if anything just subtrack ...), SearchResult(url=https://www.reddit.com/r/Archero/comments/exi4qz/why_you_should_take_more_than_1_multishot_and_1/, title=Why you SHOULD take more than 1 multishot and 1 front ..., description=Similarly, sometimes multishot seems to do new_dmg_mult = old_dmg_mult *=0.908, instead of subtracking 10%. ... It is time that developers drop in ...), SearchResult(url=https://www.reddit.com/r/RaidShadowLegends/comments/1ede8xf/turn_attack_tournament_low_budget_cheese/, title=Turn Attack Tournament Low Budget Cheese, description=Subtrack the Energy spent in these low stages from the Energy spent ... Raid developer sold to Swedish gaming company MTG. 126 upvotes ...), SearchResult(url=https://www.reddit.com/r/modular/comments/170c9ar/specific_multi_tap_delay_question_to_all_the/, title=Specific multi tap delay question to all the rainmaker owners, description=To me Rainmaker is more for experimental sound design. ... It takes about five minutes to set up a template with each tap being its own subtrack.), SearchResult(url=https://www.reddit.com/r/tf2/comments/1yyybo/suggestion_respawn_time_last_life/, title=[Suggestion] Respawn time <= Last Life : r/tf2, description=you should go read up on the amount of research, testing, and development valve has put into tf2 throughout the years before it was released.), SearchResult(url=https://www.reddit.com/r/PleX/comments/g0kcu1/from_dvd_to_pi_to_plex_full_guide/, title=From DVD, to Pi, to Plex (full guide!), description=... subtrack $SUBTRACK"" mkvextract tracks $INFILE $SUBTRACK:$INBASE.sub ... /dev/sda1 /mnt/pms ext4 defaults 0 1. Then just make the mount point ...), SearchResult(url=https://www.reddit.com/r/iOSProgramming/comments/yhb0mm/mngardientcolorpicker_a_gradient_color_picker_for/, title=MNGardientColorPicker - A gradient color picker for iOS, description=I've been using this in my app Subtrack for a while now and finally decided to open source it. ... Now I'm a full time iOS dev employed in big ...), SearchResult(url=https://www.reddit.com/r/Korean/comments/hy4ylb/viki_learn_mode_subtitle_tipp/, title=Viki Learn Mode Subtitle Tipp : r/Korean, description=Open the devtools of your browser (usually F12) once the video starts and search for ""vkp-custom-subtitle-subTrack "". Give that element the ...), SearchResult(url=https://www.reddit.com/r/rocksmith/comments/x9y873/sorry_ubisoft_im_not_buying/, title=Sorry Ubisoft I'm not buying. : r/rocksmith, description=I dont subtract a song necessarily because it was recorded live. ... Developer Confirms That Over 17 Million Hours of Baldur's Gate 3 Has ...), SearchResult(url=https://www.reddit.com/r/AskElectronics/comments/xy6m51/ground_benchtop_vs_portable_scopes/, title=Ground: Benchtop vs. Portable Scopes : r/AskElectronics, description=well you should be using TWO probes, and use math in the scope to subtrack one probe from the other. Or a differential probe. i would NEVER ...), SearchResult(url=https://www.reddit.com/r/AnalogCommunity/comments/ikbn27/just_received_seemingly_very_old_exposed_120_film/, title=Just received seemingly very old exposed 120 film. Need ..., description=Add or subtract dev times accordingly. This isnt an exact science when dealing with film that old. I developed a roll of my dads that had ...), SearchResult(url=https://www.reddit.com/r/Vive/comments/l1wvsu/how_sensitive_are_the_lighthouse_stations/, title=How sensitive are the Lighthouse stations? : r/Vive, description=I'm afraid we are talking multiple meters and 360° in all directions. I've tried tracking both platform and headset and then subtracking the ...)]"
1,Hyphen,Medical Data Annotation Software,https://www.hyphenlabs.tech,,None,[]
