,company_name,short_description,website,direct_mentions_count,direct_mentions,all_search_results
2,Ryvn,"Deploy, update, and monitor applications in customer clouds",https://ryvn.ai,,None,"[SearchResult(url=https://www.reddit.com/r/NBAYoungboy/comments/tg19qh/nba_youngboy_art_by_ryvn_ferpy/, title=NBA YOUNGBOY ART BY RYVN FERPY : r/NBAYoungboy, description=OG AI YoungBoy putting up numbers    . r/NBAYoungboy - OG AI YoungBoy putting up numbers    . 113 upvotes · 27 comments. r/NieRAutomataGame ...), SearchResult(url=https://www.reddit.com/r/NBAYoungboy/comments/ol0pum/nba_art_by_ryvn_ferpy/, title=NBA Art By Ryvn Ferpy : r/NBAYoungboy, description=25 votes, 14 comments. 44K subscribers in the NBAYoungboy community. Dedicated to Baton Rouge rapper NBA YoungBoy.), SearchResult(url=https://www.reddit.com/r/PlayWayfinder/comments/16c8m2y/why_does_everyone_cheese_the_firsts_mechanics/, title=Why does everyone Cheese the First's mechanics?, description=The request often pops up in Warframe for longer, more varied boss fights with more complex fight mechanics.), SearchResult(url=https://www.reddit.com/r/trapmetal/comments/ty1tsu/gas_prod_ryvn_beats/, title=Gas (prod. ryvn beats) : r/trapmetal, description=6K subscribers in the trapmetal community. A subreddit for the genre of ""trap metal"" which combines elements of rap and metal/punk music for an…), SearchResult(url=https://www.reddit.com/r/PlayWayfinder/comments/17shy86/is_it_a_way_to_farm_accessories_on_here/?tl=fr, title=Y a-t-il un moyen de farmer des accessoires ici, description=Je cherche un objet appelé dernier souffle, celui que j'ai est niveau 9 et je suis niveau 28.), SearchResult(url=https://www.reddit.com/r/PlayWayfinder/comments/176shov/was_there_a_patch_where_vestige_drop_rates_were/?tl=fr, title=Y avait-il un patch où les taux de chute de Vestige ont été ..., description=Je sais que j'ai dû farmer Ryvn pendant un certain temps avant d'obtenir enfin toutes les pièces du Silo, mais la Gueule de la Nuit pour les ...), SearchResult(url=https://www.reddit.com/r/PlayWayfinder/comments/160jd1z/how_the_fk_to_get_silo_precision/?tl=it, title=Come cavolo si ottiene la precisione del silo, description=Ho coltivato Ryvn per circa 6 ore senza una singola goccia. È pazzesco. Sto sbagliando qualcosa? Sono al faro del deposito, coltivo la sfera ...), SearchResult(url=https://www.reddit.com/r/NBAYoungboy/comments/opr4sl/nba_youngboy_white_teeth_action_figure_by_ryvn/?tl=it, title=FIGURA DI AZIONE NBA YOUNGBOY DENTI BIANCHI ..., description=FIGURA DI AZIONE NBA YOUNGBOY DENTI BIANCHI Di Ryvn Ferpy. ART. r ...), SearchResult(url=https://www.reddit.com/r/cartooonn/comments/1fu8935/babies_mc_tuto_mc_joaozinho_vt_cartoon_ryvn_ferpy/?tl=fr, title=BABIES MC TUTO, MC JOAOZINHO VT CARTOON RYVN ..., description=BABIES MC TUTO, MC JOAOZINHO VT CARTOON RYVN FERPY @ryvn_ferpy · Section des commentaires · Davantage de publications susceptibles de vous plaire.), SearchResult(url=https://www.reddit.com/r/cartooonn/comments/1fu8935/babies_mc_tuto_mc_joaozinho_vt_cartoon_ryvn_ferpy/?tl=it, title=BABIES MC TUTO, MC JOAOZINHO VT CARTOON RYVN ..., description=34 subscribers in the cartooonn community. RYVN FERPY RANDOM CARTOONS.), SearchResult(url=https://www.reddit.com/r/PlayWayfinder/comments/162i18t/trickster_coins_killing_the_fun_for_me/?tl=fr, title=Les pièces du farceur gâchent mon plaisir : r/PlayWayfinder, description=Je pense que je suis maudit, j'ai enfin eu les pièces et je suis passé à la ferme de Ryvn. Plus de 10 kills plus tard, pas une seule chute ...), SearchResult(url=https://www.reddit.com/r/civ/comments/q9b89n/one_city_challenge_tips/, title=One city challenge tips : r/civ, description=Since the AI strongly prioritises building Campuses, you can abuse ... RYVn-rRY ...), SearchResult(url=https://www.reddit.com/r/PlayWayfinder/comments/1dhpaxb/leveling/?tl=fr, title=Nivellement : r/PlayWayfinder, description=... ai collectés, j'ai obtenu un personnage différent presque au même ... Pour les wayfinders, après le premier, il y a des boss comme Ryvn qui ...), SearchResult(url=https://www.reddit.com/r/PlayWayfinder/comments/18kwfvx/is_reaver_king_supposed_to_be_this/?tl=fr, title=Le Roi Ravageur est-il censé être aussi difficile/frustrant ou ..., description=... Ryvn (pas en même temps mais entre les phases si je me souviens bien) ... Une fois que j'ai construit mon personnage pour la santé maximale, j'ai ...), SearchResult(url=https://www.reddit.com/r/PlayWayfinder/comments/178tnmj/are_vestiges_bugged_or_just_extremely_rare/?tl=fr, title=Les vestiges sont-ils bugués ou simplement extrêmement ..., description=J'ai perdu le compte exact, mais je l'ai battue près de 30 fois ... Je suis dans une situation similaire avec les vestiges de Ryvn et de Silo.), SearchResult(url=https://www.reddit.com/r/PlayWayfinder/comments/16h5g66/niss_build/?tl=fr, title=Construction Niss : r/PlayWayfinder, description=J'ai trouvé beaucoup de combos différents avec les Greatswords pour m'écarter et ne pas rester coincé dans les animations, donc cela correspond ...), SearchResult(url=https://www.reddit.com/r/NoStupidQuestions/comments/13a9drn/who_do_you_think_buckets_the_drummer_really_is/, title=Who do you think Buckets the drummer really is?, description=Rufus Tiger Taylor is my guess if the info given are clues. His band could be darkness. But this my sole investigative theory. Edit: or weazer.), SearchResult(url=https://www.reddit.com/r/MechanicalKeyboards/comments/mu2k04/my_roommate_and_i_um_have_slightly_different/, title=My Roommate and I, um... Have Slightly Different Tastes, description=... Artificial Intelligence & Machine Learning · Computers & Hardware ... MASSIVE thank you u/Ryvn- for my first award!!! Reply reply.), SearchResult(url=https://www.reddit.com/r/berkeley/comments/hudiv0/dont_apply_to_the_consulting_clubscs_orgsbusiness/, title=Don't apply to the consulting clubs/CS orgs/business frats, description=Ryvn-. • 4y ago •. Instead of an exclusive club, I suggest to ... Feeling Defeated by Berkeley's AI Research Opportunities as a Non-CS Major.), SearchResult(url=https://www.reddit.com/r/berkeley/comments/hyxzcu/cs_classes_at_berk_make_me_want_to_cry/, title=cs classes at berk make me want to cry : r/berkeley, description=Ryvn-. • 4y ago •. gitlet is difficult so don't let it bring you ... I'm currently AI-ing for this course (61bl) and I get to see what ...), SearchResult(url=https://www.reddit.com/r/berkeley/comments/z9ahbc/failing_at_uc_berkeley/, title=Failing at UC Berkeley : r/berkeley, description=Ryvn-. • 2y ago •. Start dropping into office hours or drop ... Feeling Defeated by Berkeley's AI Research Opportunities as a Non-CS Major.), SearchResult(url=https://www.reddit.com/r/berkeley/comments/xab499/how_common_o_or_rare_is_it_to_get_faang/, title=How Common o Or Rare Is It To Get FAANG Internships As ..., description=A lot of kids choose to do other things though like interdisciplinary stuff (consulting company work or biotech), more niche stuff (AI, cloud ...), SearchResult(url=https://www.reddit.com/r/PlayWayfinder/comments/17hqd1n/what_did_you_struggle_with/?tl=fr, title=Avec quoi avez-vous lutté ? : r/PlayWayfinder, description=La ferme Ryvn en est ... La première était une autre supérieure avec qui j'ai eu du mal lorsque je l'ai rencontrée pour la première fois.), SearchResult(url=https://www.reddit.com/r/PlayWayfinder/comments/160dkif/found_ryvn/?tl=it, title=Trovato Ryv'n : r/PlayWayfinder, description=Vai ai commenti. Condividi. Ordina per: Top (Default). Ordina per ... Ryvn mi ha fatto fuori con un solo colpo, così come un altro ragazzo. Il ...), SearchResult(url=https://www.reddit.com/r/berkeley/comments/lkqzya/panicking_about_job_prospects/, title=Panicking about job prospects - Berkeley, description=Ryvn-. • 4y ago •. that a grim way of seeing it... Op is a ... Feeling Defeated by Berkeley's AI Research Opportunities as a Non-CS Major.), SearchResult(url=https://www.reddit.com/r/DivinityOriginalSin/comments/1afs9za/in_act_ii_seeds_of_power_quest_is_it_better_to/?tl=fr, title=Dans l'Acte II - Quête Seeds of Power est-il préférable de ..., description=... ai regardé partout où je peux penser, mais rien. Pour autant que je ... Tt Dr ryvn f chfdttyxyxt ft j Gft G> t tv uzhf7hyio dzr ZZZ i ...), SearchResult(url=https://www.reddit.com/r/berkeley/comments/hho2nr/how_timeconsuming_and_hard_is_cs_at_berekely/, title=How time-consuming and hard is CS at Berekely? : r/berkeley, description=I wanted to ask about the average workload for computer science at UC Berkeley. I am a rising senior and I am very interested in AI and ...), SearchResult(url=https://www.reddit.com/r/remix/comments/15d1t1z/tech_house_remix_i_made_for_travis_scott_modern/?tl=fr, title=Tech House Remix que j'ai réalisé pour Travis Scott, description=https://soundcloud.com/ryvn_official/travis-scott-modern-jam-ryvn-dups-remix?si=2e278207b2b44b84922338ff1b68a42b&utm_source= ...), SearchResult(url=https://www.reddit.com/r/csMajors/comments/qfo1xp/how_do_you_effectively_prep_and_practice_for_the/, title=How do you effectively prep and practice for the ..., description=Ryvn-. • 3y ago •. keep rolling dice till you get 4 1s in a row, then start. or you can do their practice tests on their website, either one ...), SearchResult(url=https://www.reddit.com/r/berkeley/comments/o5u32i/triple_dorm_how_bad_is_it/, title=triple dorm... how bad is it? : r/berkeley, description=Ryvn-. • 3y ago •. Triple is not bad (if you roll well in the ... Feeling Defeated by Berkeley's AI Research Opportunities as a Non-CS Major.), SearchResult(url=https://www.reddit.com/r/berkeley/comments/1065mog/good_classes_to_take_for_learning_web_app_design/, title=Good classes to take for learning web app design? - Berkeley, description=Ryvn-. • 2y ago •. game design decal? Upvote 1. Downvote ... Which udemy course is best for AI and Machine Learning? 8 upvotes ...), SearchResult(url=https://www.reddit.com/r/berkeley/comments/srlmx1/can_berkeley_rescind_my_fall_2022_application_if/, title=Can Berkeley rescind my fall 2022 application if I got a D in ..., description=Ryvn-. • 3y ago •. dont thing they cant ""rescind"" but they can ... Feeling Defeated by Berkeley's AI Research Opportunities as a Non-CS Major.), SearchResult(url=https://www.reddit.com/r/berkeley/comments/lhtler/berkeley_finance_club/, title=Berkeley Finance Club, description=... Artificial Intelligence & Machine Learning · Computers & Hardware ... Ryvn-. • •. Zzzzzz ok when it is this easy to get in, it's not ...)]"
3,Gander,"LLMs For Aviation, Starting with Customer Service",https://usegander.com,,None,[]
4,Innate,Teachable general-purpose robots,https://innate.bot,,None,"[SearchResult(url=https://www.reddit.com/r/discordapp/comments/yns20a/im_creating_a_bot_totally_customisable_where_you/, title=I'm creating a bot totally customisable where you could ..., description=So basically bring the guilded innate bot system to discord?), SearchResult(url=https://www.reddit.com/r/JuJutsuKaisen/comments/zgh5zg/in_theory_if_yuji_got_a_domain_expansion_would_it/, title=In theory, if Yuji got a domain expansion, would it be ..., description=He has never used any for of technique in the series. Not just Innate bot not even RCT, barrier or even shikigami technique so rn there is 0% ...), SearchResult(url=https://www.reddit.com/user/smalleyesbigheart/, title=smalleyesbigheart, description=... , and if she can do it again, with a better macro game plan, SFD can abuse their innate bot lane advantage and turn them into wins. Upvote 4. Downvote 7 ...)]"
5,CollectWise,Automating consumer debt collection with AI,https://collectwise.com/,,None,"[SearchResult(url=https://www.reddit.com/r/debtfree/comments/16nledl/anybody_get_these_texts_scam_collector/, title=Anybody get these texts? scam collector? : r/debtfree, description=I get calls from them all the time and now texts but nothing ever says what the actual debt is and as of now there's no damage on my credit report.), SearchResult(url=https://www.reddit.com/r/Scams/comments/vnr9ir/is_this_a_scam_the_company_is_legit_and_i_applied/, title=Is this a scam? The company is legit, and I applied through ..., description=Most likely a scam. Verify with the company and LinkedIn, then report to FTC to help catch or stop these scammers from victimizing vulnerable jobseekers.), SearchResult(url=https://www.reddit.com/r/ChatGPT/comments/13r894v/ai_tools_to_automate_asking_customers_to_pay/, title=AI tools to automate asking customers to pay their bills? ..., description=Are there any AI tools that can help me ask my customers for money? Process today is to send out emails to customers who have outstanding balances past due ...), SearchResult(url=https://www.reddit.com/r/smallbusiness/comments/warxpa/dont_use_wise_transferwise_for_money_transfers/, title=DON'T use Wise (TransferWise) for Money Transfers, description=Wise acts like they're unable to locate your ACH transfer in order to hold on to your money as long as possible. Also, TrustPilot can't be trusted.), SearchResult(url=https://www.reddit.com/r/readwise/comments/17e4d6c/using_readwise_to_store_my_quotes_collection/, title=Using Readwise to store my quotes collection?, description=You can create a custom book in the Readwise app by selecting Add Highlights > Add via text. Many users just name the book something like Quotes and the author ...), SearchResult(url=https://www.reddit.com/r/BattleNetwork/comments/1bo7xoq/i_give_up_mmbn4/, title=I give up, MMBN4 : r/BattleNetwork, description=Biggest time saver ever. Beat the game run in about eh, 5 hours just me on rush mode. 100% collect wise, about 8-10 hours per game run.), SearchResult(url=https://www.reddit.com/r/comicbookcollecting/comments/1ajulv6/gotta_be_a_steal_for_3_right/, title=Gotta be a steal for $3 right? : r/comicbookcollecting, description=I have the DE and CovrPrice tags it at $5. Is there a big difference between DE and newsstand collect-wise?), SearchResult(url=https://www.reddit.com/r/ffxiv/comments/ujayn4/struggling_with_mass_mining_materials/, title=Struggling with mass mining materials : r/ffxiv, description=Hi! I am having some major problems figuring out the best/most efficient way to mine big stacks of materials at nodes.), SearchResult(url=https://www.reddit.com/r/mytimeatportia/comments/cj3zn4/who_yall_been_marrying/, title=Who y'all been marrying?!! : r/mytimeatportia, description=I've recently started up for the first time & so far I'm interested in Paulie as he seems unique to me & so far seems out-of-the-norm of the usual character ...), SearchResult(url=https://www.reddit.com/r/LifeProTips/comments/2h1qbk/lpt_divide_your_life_into_7_sections_to_maintain/, title=LPT : Divide your life into 7 sections to maintain balance..., description=Divide your life up into 7 sections : Family and Relationships. Work (current job) and Career (long term),.), SearchResult(url=https://www.reddit.com/user/RandomPerson1335/, title=Hello (u/RandomPerson1335), description=... to pay their bills? (dunning process/debt collection) · RandomPerson1335 commented 5 mo. ago. https://www.collectwise.org/. Upvote 1. Downvote Share Share ...), SearchResult(url=https://www.reddit.com/r/ChatGPT/comments/13r894v/ai_tools_to_automate_asking_customers_to_pay/?tl=nl, title=AI-tools om het vragen om betaling van klanten te automatiseren ..., description=... Upvote 1. Downvote Award Share. u/RandomPerson1335 avatar · RandomPerson1335. • 8mo ago •. https://www.collectwise.org/. Upvote 1. Downvote Award Share.), SearchResult(url=https://www.reddit.com/r/ChatGPT/comments/13r894v/ai_tools_to_automate_asking_customers_to_pay/?tl=fr, title=Outils d'IA pour automatiser la demande de paiement aux ..., description=Récompenser Partager. avatar u/RandomPerson1335 · RandomPerson1335. • -8 m. •. https://www.collectwise.org/. Upvote 1. Downvote Récompenser)]"
6,Consus,Your single source of truth for government documents,https://www.consusindustries.co/,,,
7,Alex,The Cursor for Xcode,https://alexcodes.app,,,
